Level	Symbol	Meaning	Kanji Component Name	Kanji Component Symbol	Meaning Mnemonic	Word Type	Reading	Reading Whitelist	Reading Mnemonic	Reading Audio Male	Reading Audio Female	Context 1-EN	Context 1-JP	Context 2-EN	Context 2-JP	Context 3-EN	Context 3-JP	Context 4-EN	Context 4-JP
8	向こう	Over There,Opposite Side,Other Side,Far Away	Yonder	向	"You know that <jp>向</jp> means <kanji>yonder</kanji>. So, think of a ""yonder <jp>こういち</jp>."" All you know is that he's <vocabulary>over there</vocabulary> on the <vocabulary>other side</vocabulary> / <vocabulary>opposite side</vocabulary> of where you are. Basically, he's just pretty <vocabulary>far away</vocabulary>, wherever he is."	noun	<reading><jp>むこう</jp></reading>	むこう	"Since this word consists of a kanji with hiragana attached, you can bet that it will use the kun'yomi reading. You didn't learn that reading with this kanji, so here's a mnemonic to help you: <br><br>

Standing with <jp>こういち</jp> is a cow. It is saying <reading>moo</reading> (<jp>む</jp>). Weird, now <jp>こういち</jp> is saying it too. Also, if you know the reading of <jp>向く</jp> you should be able to read this one as well."	[sound:Vocab-むこう-Male.mp3]	[sound:Vocab-むこう-Female.mp3]	Let’s buy bread at the bakery over there.	<jp>向こうのパンやで、パンを買いましょう。</jp>	Ichika might have come from the other side of the world.	<jp>一花は、向こうの世界からやって来たのかもしれない。</jp>	I’ll tell you my secret if you go stand on the opposite side of the road.	<jp>もし君が道路の向こう側に立つのであれば、私の秘密を君に打ち明けるよ。</jp>	None	None
5	四角	Square,Rectangle	Four,Angle	四,角	What shape has <kanji>four</kanji> <kanji>angle</kanji>s? The most common one is a <vocabulary>square</vocabulary>.	noun,な adjective,の adjective	<reading><jp>しかく</jp></reading>	しかく	This is a jukugo word that uses the on'yomi readings for the kanji. You've learned them both already, so you should be able to read this word!	[sound:Vocab-しかく-Male.mp3]	[sound:Vocab-しかく-Female.mp3]	Cut the potatoes into squares, please.	<jp>じゃがいもを、四角に切ってください。</jp>	I want the twitter icon to go back from the current round shape to the square one.	<jp>ツイッターのアイコンの形を今の丸から四角にもどしてほしい。</jp>	Why are most windows either squares or rectangles? They should start making windows shaped like Italy.	<jp>どうしてほとんどの窓は真四角か長四角なんだろう。イタリア型の窓とかも作ったらいいのに。</jp>	None	None
5	谷	Valley	Valley	谷	The kanji and the word are exactly the same. That means they share meanings as well.	noun	<reading><jp>たに</jp></reading>	たに	Since this word is made up of a single kanji, it should use the kun'yomi reading. This happens to be the reading you learned with the kanji, too, so don't feel like you're stuck in a valley of despair or anything. Rejoice!	[sound:Vocab-たに-Male.mp3]	[sound:Vocab-たに-Female.mp3]	I saw a bear in that valley.	<jp>あそこの谷で、くまを見ました。</jp>	"In Hakone, there is a valley called Owakudani, which used to be called ""Death Valley"" a long time ago, and it is a famous tourist spot nowadays."	<jp>はこねには大わく谷というむかし「じごく谷」といわれた谷があって、かんこうの名しょになっています。</jp>	The guy who committed suicide in Death Valley was dressed as Darth Vader.	<jp>死の谷で自殺した男は、ダース・ベイダーのコスプレをしていた。</jp>	None	None
5	走行	Traveling,Running,Moving	Run,Go	走,行	"A vehicle that <kanji>run</kanji>-<kanji>go</kanji>es is <vocabulary>running</vocabulary> and it's <vocabulary>moving</vocabulary> you somewhere else. You're <vocabulary>traveling</vocabulary>!<br><br>

We usually use this word to describe moving or running vehicles like cars and trains. Keep an eye on those context sentences to make sure you're using it right. ;)"	noun,する verb	<reading><jp>そうこう</jp></reading>	そうこう	This is a jukugo word, which usually means on'yomi readings from the kanji. If you know the readings of your kanji you'll know how to read this as well.	[sound:Vocab-そうこう-Male.mp3]	[sound:Vocab-そうこう-Female.mp3]	Can you tell me the mileage of your car?	<jp>あなたの車の走行マイルをおしえてください。</jp>	Leaving your seat while the bus is moving is dangerous.	<jp>バスの走行中にせきを立つのはきけんです。</jp>	The train will start running to Hogwarts School of Witchcraft and Wizardry again as soon as the strike is over.	<jp>その電車は、ストライキが終わり次第、ホグワーツ魔法魔術学校への走行を再開する。</jp>	None	None
55	累積	Accumulation	Accumulate,Accumulate	累,積	<kanji>Accumulate</kanji> and <kanji>accumulate</kanji> make <vocabulary>accumulation</vocabulary>!	noun,する verb,の adjective	<reading><jp>るいせき</jp></reading>	るいせき	This is a jukugo word that uses the on'yomi readings of the kanji. You should be able to read this on your own.	[sound:Vocab-るいせき-Male.mp3]	[sound:Vocab-るいせき-Female.mp3]	How do you think the Japanese government accumulated such a great amount of national debt? 	<jp>日本政府が巨額の国債を累積していることについて、あなたはどのようにお考えですか。</jp>	None	None	None	None	None	None
5	近い	Close,Nearby,Near	Near	近	This is a single kanji with an <jp>い</jp> on the end, meaning you know it's probably an adjective. What's the adjective form of <kanji>near</kanji>? It's <vocabulary>close</vocabulary> or <vocabulary>nearby</vocabulary>.	い adjective	<reading><jp>ちかい</jp></reading>	ちかい	"Since this word consists of a kanji with hiragana attached, you can bet that it will use the kun'yomi reading. You didn't learn that reading with this kanji, so here's a mnemonic to help you: <br><br>

You have to remember the <jp>ちか</jp> portion to be able to read this word. Imagine someone <vocabulary>close</vocabulary> to you... Too close. They are so close to you that they're touching their <reading>cheek</reading> (<jp>ちか</jp>) to your cheek. Feel the cheek on yours, it's getting awkward."	[sound:Vocab-ちかい-Male.mp3]	[sound:Vocab-ちかい-Female.mp3]	My house is close to the station.	<jp>わたしのいえはえきから近いです。</jp>	I'm wearing close to no makeup today.	<jp>今日は、ほぼすっぴんに近いです。</jp>	Drinking American beer is like doing somersaults in a canoe. It’s too close to water.	<jp>アメリカのビールって、カヌーの上ででんぐり返しをするみたいなものだよね。超水に近いんだもん。</jp>	None	None
5	近日	Soon,In A Few Days,Coming Days	Near,Sun	近,日	The <kanji>near</kanji> <kanji>day</kanji> is a day coming very <vocabulary>soon</vocabulary>. It's a day coming <vocabulary>in a few days</vocabulary>.	noun	<reading><jp>きんじつ</jp></reading>	きんじつ	The readings are both on'yomi readings that you've learned. Just take note that <jp>日</jp> is the alternate reading <jp>じつ</jp>.	[sound:Vocab-きんじつ-Male.mp3]	[sound:Vocab-きんじつ-Female.mp3]	This game is scheduled to be released soon.	<jp>このゲームは、近日はつばいよていです。</jp>	The movie Mr. Tanaka was looking forward to will finally be released in a few days.	<jp>田中さんがたのしみにしていたえいがが、ついに近日こうかいします。</jp>	Let’s hang out in person soon and talk about things we saw online.	<jp>近日中にお会いして、ネットで見たことを一緒に語り合いましょう。</jp>	None	None
8	近づく	To Get Close,To Approach,To Draw Near,To Near,To Bring Near	Near	近	Because this word ends with an <jp>う</jp> sound, you can tell it's probably a verb. The kanji portion means <vocabulary>near</vocabulary>. The verb version of that is <vocabulary>to draw near</vocabulary>, <vocabulary>to get close</vocabulary> or <vocabulary>to approach</vocabulary>. Essentially, the general idea is that you're getting closer to something. You're becoming more nearby. You're approaching.	intransitive verb,godan verb	<reading><jp>ちかづく</jp></reading>	ちかづく	There's hiragana attached to this kanji, which means it's probably the kun'yomi reading (and it is). You've seen the kun'yomi reading via the word <jp>近い</jp>. So, as long as you know that word, you should be able to read this one as well.	[sound:Vocab-ちかづく-Male.mp3]	[sound:Vocab-ちかづく-Female.mp3]	When the cameraman approached it, the turtle ran away.	<jp>カメラマンが近づくとカメはにげてしまった。</jp>	Don't go anywhere near my girlfriend!	<jp>おれの女に近づくな！</jp>	Strange as it is, the zombie approaching us right now is actually my type.	<jp>私達に今近づいてきているゾンビ、めちゃくちゃ私のタイプなんだけど。</jp>	None	None
10	強調	Emphasis,Highlight,Stress	Strong,Investigate	強,調	If you use a <kanji>strong</kanji> <kanji>tone</kanji> on certain words, then you are putting <vocabulary>emphasis</vocabulary> on whatever it is you're talking about. It's the <vocabulary>stress</vocabulary> you put on things that are important because your tone gets stronger on those words or syllables.	noun,する verb	<reading><jp>きょうちょう</jp></reading>	きょうちょう	This is a jukugo word, which usually means on'yomi readings from the kanji. If you know the readings of your kanji you'll know how to read this as well.	[sound:Vocab-きょうちょう-Male.mp3]	[sound:Vocab-きょうちょう-Female.mp3]	I'd like to emphasize that Tofugu articles are super high quality, interesting, and helpful.	<jp>Tofuguの記事は超ドきゅうにおも白くて役に立つことを強調しておきたい。</jp>	Highlighting important words with a highlighter helps you memorize them.	<jp>大事な用語は、けい光ペンで強調するとおぼえやすいよ。</jp>	I’d just like to stress again that dressing neatly and being polite are very important for this job.	<jp>この仕事では身支度をきちんとしていることと礼儀正しいことが重要になることを改めて強調させて頂きます。</jp>	None	None
10	開発	Development	Open,Departure	開,発	You are now <kanji>open</kanji> for <kanji>departure</kanji>. You get on your boat and leave this place. You are going to another place to start its <vocabulary>development</vocabulary> where you will create a new world.	noun,する verb,の adjective	<reading><jp>かいはつ</jp></reading>	かいはつ	This is a jukugo word, which usually means on'yomi readings from the kanji. If you know the readings of your kanji you'll know how to read this as well.	[sound:Vocab-かいはつ-Male.mp3]	[sound:Vocab-かいはつ-Female.mp3]	The development team will answer everyone’s questions.	<jp>開発チームがみなさんのごしつもんにお答えします。</jp>	Please tell us about the story behind Tofugu's development.	<jp>トーフグの開発ひ話を教えてください。</jp>	Koichi pulled an all-nighter to develop a new Japanese learning site.	<jp>コウイチは新しい日本語学習サイトを開発するために徹夜をした。</jp>	None	None
10	病人	Sick Person,Patient	Sick,Person	病,人	A <kanji>person</kanji> who is <kanji>sick</kanji> is a <vocabulary>sick person</vocabulary>. They are also a <vocabulary>patient</vocabulary>, at least we can hope they are, for their sake.	noun	<reading><jp>びょうにん</jp></reading>	びょうにん	This is a jukugo word, which usually means on'yomi readings from the kanji. If you know the readings of your kanji you'll know how to read this as well. Note that this uses the <jp>にん</jp> reading for <jp>人</jp>. This is because every sick person enjoys laying in bed playing <reading>nin</reading>tendo.	[sound:Vocab-びょうにん-Male.mp3]	[sound:Vocab-びょうにん-Female.mp3]	If you don’t want to catch something, you shouldn’t go near sick people.	<jp>うつったらいやだから、病人には近よりたくない。</jp>	The fortuneteller told me that my previous life was as a sick person.	<jp>うらないしに、前世は病人だったと言われました。</jp>	"""How’s it going?"" ""Couldn’t be better."" ""Good. I’m surprised to hear that from a sick person though."""	<jp>「調子はどうだい？」「絶好調だよ。」「それは良かった。病人からその言葉を聞けるとは思ってもみなかったがな。」</jp>	None	None
33	物真似	Impersonation	Thing,Reality,Resemble	物,真,似	"<jp>真似</jp> is ""impersonation."" Actually, this word is too. It's also <vocabulary>impersonation</vocabulary>."	noun,する verb	<reading><jp>ものまね</jp></reading>	ものまね	The reading is <jp>物</jp> plus <jp>真似</jp> put together.	[sound:Vocab-ものまね-Male.mp3]	[sound:Vocab-ものまね-Female.mp3]	"""What do you do every day?"" ""I practice impersonations all day, every day."""	<jp>「いつも何してるの？」「毎日一日中物真似の練習をしてるよ。」</jp>	None	None	None	None	None	None
5	麦	Wheat,Barley,Oats	Wheat	麦	The kanji and the word are exactly the same. That means they share meanings as well.	noun	<reading><jp>むぎ</jp></reading>	むぎ	Since this word is made up of a single kanji that uses the kun'yomi reading which is the reading you learned with the kanji.	[sound:Vocab-むぎ-Male.mp3]	[sound:Vocab-むぎ-Female.mp3]	I have a wheat allergy.	<jp>わたしは、麦アレルギーがあります。</jp>	What's the difference between barley and wheat?	<jp>大麦と小麦のちがいは何ですか。</jp>	"""Squats, squats, squats, squats, oats and squats,"" he sang while squatting."	<jp>「スクワット、スクワット、スクワット、麦とスクワット♪」屈伸をしながら彼は歌った。</jp>	None	None
4	切手	Postage Stamp,Stamp	Cut,Hand	切,手	To remember the meaning of this word, just think about how in the olden days, before perforation was invented, people had to <kanji>cut</kanji> their <vocabulary>postage stamp</vocabulary>s by <kanji>hand</kanji>. It took forever, especially if you had a lot of friends to mail things to. Be thankful that perforation was invented to save you time cutting them.	noun	<reading><jp>きって</jp></reading>	きって	"You'd think that the reading for this would consist of the on'yomi readings, but human body parts (hand) do funny things to words. In this case, it's the kun'yomi readings of both the kanji. You should know the kun'yomi reading for <kanji><span lang=""ja"">切</span></kanji> and <kanji><span lang=""ja"">手</span></kanji> from the previous levels, meaning you should be able to remember the reading for this word fairly easily. Watch out for the small <jp>っ</jp>, though."	[sound:Vocab-きって-Male.mp3]	[sound:Vocab-きって-Female.mp3]	Then I’m going to go to the post office and buy stamps.	<jp>それから、ゆうびんきょくへいって、切手をかいます。</jp>	That foreigner bought 10,000 postage stamps.	<jp>あの外人さんは切手を一万まいもかっていったよ。</jp>	Since I lost her, I've lost interest in stamp collecting.	<jp>彼女を失ってから、切手集めへの興味も失ってしまった。</jp>	None	None
7	不人気	Unpopular,Not Popular	Not,Person,Energy	不,人,気	"You already know <jp>人気</jp> which means ""popular."" And you also know that <jp>不</jp> means ""not."" So what do you get when you combine the two? Something that's <vocabulary>not popular</vocabulary> or <vocabulary>unpopular</vocabulary>."	noun,な adjective	<reading><jp>ふにんき</jp></reading>	ふにんき	This is a jukugo word, which usually means on'yomi readings from the kanji. If you know the readings of your kanji you'll know how to read this as well.	[sound:Vocab-ふにんき-Male.mp3]	[sound:Vocab-ふにんき-Female.mp3]	What do you think is the most unpopular anime this year?	<jp>今年、もっとも不人気だったアニメは何だと思いますか。</jp>	The Koichi vs Michael sumo match is unpopular because it lacks the intensity when you watch it on YouTube.	<jp>コウイチたいマイケルのすもうのし合は、Youtubeで見るとはく力に欠けるので不人気です。</jp>	"He was unpopular among his classmates because his favorite phrase was, ""I’m gonna tell your mom."""	<jp>「お前の母ちゃんに言ってやる」が口癖だったため、彼はクラスメートに不人気だった。</jp>	None	None
8	見直す	To Reevaluate,To Look Again,To Reassess	See,Fix	見,直	"You know the word <jp>直す</jp> from a couple levels ago. It means ""to fix."" So, when you fix what you see, what are you doing? You're reevaluating something. That's why this word means <vocabulary>to reevaluate</vocabulary>."	godan verb	<reading><jp>みなおす</jp></reading>	みなおす	The readings are all kun'yomi readings, like the vocab you've seen already. This is like two vocab words put together, which is why it's using the kun'yomi reading. The hiragana on the end is a hint!	[sound:Vocab-みなおす-Male.mp3]	[sound:Vocab-みなおす-Female.mp3]	Let’s look at the plans one more time.	<jp>もう一ど、けいかくを見直しましょう。</jp>	On the last junk removal day, my husband was much more dependable than I expected and it made me look at him differently.	<jp>この間のはいひん回しゅうの日、主人が思ったよりたよりになって、ちょっと見直しちゃった。</jp>	I think you should reevaluate your choices in university classes. I don’t think catching dodo birds is a good career path.	<jp>大学の授業の選択を見直す方がいいと思うよ。だって、愚鳩を捕まえるのが、いいキャリアになるとは思えないもん。</jp>	None	None
5	下町	Downtown,Backstreets	Below,Town	下,町	You have the <kanji>below</kanji> <kanji>town</kanji>. Does this sort of sound familiar? We have another word for it in English, but it's essentially the same thing: <vocabulary>downtown</vocabulary>. It isn't the downtown you might be used to though. In Japan, this is an old word that was used for the commercial districts literally, physically down (lower than) the main city. So picture an old, urban Japanese area!	noun	<reading><jp>したまち</jp></reading>	したまち	The reading for this word is all kun'yomi despite being jukugo. Just think of sketchy things going on in the downtown, just like how there's sketchy kun'yomi readings for this word. You should know both the kun'yomi readings from the previous level, though, so if you do you know the reading for this word as well.	[sound:Vocab-したまち-Male.mp3]	[sound:Vocab-したまち-Female.mp3]	I grew up downtown.	<jp>わたしは、下町でそだちました。</jp>	I'd like to go to a good old fashioned saloon in the backstreet areas of the old cities of Tokyo.	<jp>とうきょうの下町にあるむかしながらのさかばに行ってみたいです。</jp>	A shitamachi is an old Japanese style of downtown; it isn’t the same as the downtown we think of today.	<jp>下町とは、日本の古いスタイルのダウンタウンのことで、現代のものとは異なっている。</jp>	None	None
57	普遍	Universal,Ubiquitous,Omnipresent	Normal,Universal	普,遍	Something <kanji>normal</kanji> and <kanji>universal</kanji> is still <vocabulary>universal</vocabulary>. Normally.	な adjective	<reading><jp>ふへん</jp></reading>	ふへん	This is a jukugo word that uses the on'yomi readings of the kanji. You should be able to read this on your own.	[sound:Vocab-ふへん-Male.mp3]	[sound:Vocab-ふへん-Female.mp3]	Universal themes are easily accepted by many people.	<jp>普遍的なテーマは、多くの人に受け入れられやすい。</jp>	None	None	None	None	None	None
10	心配	A Worry,Concern,Anxiety,Worry	Heart,Distribute	心,配	When you <kanji>distribute</kanji> your <kanji>heart</kanji> around you, it's like your heart is everywhere at once, but not in your body. You feel frantic, you don't know what to do because your heart is out there. This represents the feeling you have when you have <vocabulary>a worry</vocabulary> or <vocabulary>concern</vocabulary>. <jp>心配しないでね！</jp>	noun,する verb,な adjective	<reading><jp>しんぱい</jp></reading>	しんぱい	This is a jukugo word, which usually means on'yomi readings from the kanji. If you know the readings of your kanji you'll know how to read this as well. Take note that the <jp>ぱい</jp> in <jp>配</jp> got rendaku'd from <jp>はい</jp>, as well.	[sound:Vocab-しんぱい-Male.mp3]	[sound:Vocab-しんぱい-Female.mp3]	I’m worried because it’s unusual for him to be so down.	<jp>かれが元気がないのはめずらしいので心配です。</jp>	I got worried about whether the ship was heading east or west.	<jp>この船の進行方向が西なのか東なのか心配になった。</jp>	Don’t worry, everything is going to be fine. You can believe what I say.	<jp>心配しないで。すべて上手くいくよ。私の言うことを信じて。</jp>	None	None
5	毛糸	Wool Yarn,Yarn	Fur,Thread	毛,糸	When you have <kanji>fur</kanji> <kanji>string</kanji> (aka string made of fur) what do you think of? Hopefully <vocabulary>wool yarn</vocabulary>.	noun	<reading><jp>けいと</jp></reading>	けいと	The readings for these kanji are the kun'yomi readings. With <jp>毛</jp> you should have learned this reading via the vocab word in the previous level. With <jp>糸</jp> it's actually the main reading for the kanji, so you should already know it.	[sound:Vocab-けいと-Male.mp3]	[sound:Vocab-けいと-Female.mp3]	Do you have green yarn?	<jp>みどり色の毛糸はありますか。</jp>	It is very cold today, so I am wearing the wool sweater that my friend knitted for me.	<jp>今日はとてもさむいので、友人があんでくれた毛糸のセーターをきています。</jp>	"""Unwind a ball of yarn please. Please. Please!"" the ghost asked me over and over again."	<jp>「毛糸の玉をほどいてください。お願いします。お願いします。」と、その幽霊は何度も私に頼んできた。</jp>	None	None
4	百	Hundred,One Hundred	Hundred	百	When a vocab word is a single kanji without okurigana (hiragana attached to the kanji) it usually has the same meaning as the kanji it's spawned from. If you know the kanji meaning you'll also know the vocab meaning. It's <vocabulary>one hundred</vocabulary>!	numeral	<reading><jp>ひゃく</jp></reading>	ひゃく	When a vocab word is a single kanji with no okurigana, it usually uses the kun'yomi reading. Numbers are an exception to this. Numbers use the on'yomi reading, which you've already learned by learning the kanji's reading! How nice!	[sound:Vocab-ひゃく-Male.mp3]	[sound:Vocab-ひゃく-Female.mp3]	I read one hundred pages in one week.	<jp>一しゅうかんで、百ページよみました。</jp>	When you get to Level 100, Prince, you can change your job from prince to king or queen.	<jp>王子がレベル百になったら王か女王にてんしょくできますよ。</jp>	I can buy a bunch of different things with a hundred yen.	<jp>百円で色々なものが買えるんですね。</jp>	None	None
5	会	Meeting,Assembly,Party	Meet	会	This is the noun version of the kanji <kanji>meet</kanji>. So it means <vocabulary>meeting</vocabulary>.	independent noun,in compounds	<reading><jp>かい</jp></reading>	かい	This has the same reading as the kanji you learned, meaning you know the reading!	[sound:Vocab-かい-Male.mp3]	[sound:Vocab-かい-Female.mp3]	I’m having a girls-only party on Friday night.	<jp>きんようびの夜に、女子会をします。</jp>	The assembly with those members sounds very interesting.	<jp>そのメンバーの会はとてもおも白そうですね。</jp>	Let’s open this meeting again!	<jp>この会、また開こうよ！</jp>	None	None
10	立ち飲み	Standing And Drinking,Drinking While Standing	Stand,Drink	立,飲	The meaning is the same as the kanji. When you <kanji>stand</kanji> and <kanji>drink</kanji>, you're <vocabulary>standing and drinking</vocabulary>.	noun	<reading><jp>たちのみ</jp></reading>	たちのみ	The readings are from the words <jp>立つ</jp> and <jp>飲む</jp> put together.	[sound:Vocab-たちのみ-Male.mp3]	[sound:Vocab-たちのみ-Female.mp3]	In summer you can stand and drink on the terrace.	<jp>夏には、テラスせきで立ち飲みもできます。</jp>	There are a lot of stand-and-drink bars near Shinbashi Station in Tokyo.	<jp>東京の新ばしえき近辺には立ち飲み屋がたくさんあります。</jp>	Did you get any action last night after leaving the standing bar?	<jp>昨日、あの立ち飲み屋の後、誰かとやった？</jp>	None	None
