Level	Symbol	Meaning	Kanji Component Name	Kanji Component Symbol	Meaning Mnemonic	Word Type	Reading	Reading Whitelist	Reading Mnemonic	Reading Audio Male	Reading Audio Female	Context 1-EN	Context 1-JP	Context 2-EN	Context 2-JP	Context 3-EN	Context 3-JP	Context 4-EN	Context 4-JP
12	悪女	Evil Woman,Wicked Woman,Bad Woman	Bad,Woman	悪,女	"A <kanji>bad</kanji> <kanji>woman</kanji> is an <vocabulary>evil woman</vocabulary>. Surprisingly, ""mother in law"" is not one of the meanings for this word."	noun	<reading><jp>あくじょ</jp></reading>	あくじょ	This is a jukugo word, which usually means on'yomi readings from the kanji. If you know the readings of your kanji you'll know how to read this as well.	[sound:Vocab-あくじょ-Male.mp3]	[sound:Vocab-あくじょ-Female.mp3]	That bitch sure has good ears!	<jp>あの悪女、耳だけはいいんだよな。</jp>	She is a wicked woman, but is always on time.	<jp>かの女は悪女だが、いつも時間はきっちり守る。</jp>	The evil woman took my breath away. I was crazy about her.	<jp>その悪女は息をのむほど美しかった。僕は彼女に夢中だった。</jp>	None	None
4	五百	Five Hundred	Five,Hundred	五,百	When you have <kanji>five</kanji> <kanji>hundred</kanji>s you also have <vocabulary>five hundred</vocabulary>.	numeral	<reading><jp>ごひゃく</jp></reading>	ごひゃく	This word uses the on'yomi readings for both kanji, so you should be able to read it already!	[sound:Vocab-ごひゃく-Male.mp3]	[sound:Vocab-ごひゃく-Female.mp3]	Please memorize five hundred kanji by the end of March.	<jp>三月まつまでに、かん字を五百こおぼえてください。</jp>	Japan has 500-yen coins.	<jp>日本には五百円玉というものがあります。</jp>	"""How are we going to get five hundred horses into one car?"" asked the woman. ""You’re right! Do you think I should have brought the van instead?"" the man replied."	<jp>「どうやって五百頭もの馬を車に乗せるっていうの？」と女が聞いた。「そうだよね。代わりにバンを持ってきた方が良かったかな。」と男は答えた。</jp>	None	None
44	携帯ストラップ	Cell Phone Strap,Mobile Phone Strap	Portable,Belt	携,帯	You know how <jp>携帯</jp> refers to a mobile phone? This is a <kanji>strap</kanji> (<jp>ストラップ</jp>) for a mobile phone, making this a <vocabulary>cell phone strap</vocabulary> or <vocabulary>mobile phone strap</vocabulary>.	noun	<reading><jp>けいたいすとらっぷ</jp></reading>,<reading><jp>けいたいストラップ</jp></reading>	けいたいすとらっぷ,けいたいストラップ	This is a jukugo word that uses the on'yomi readings of the kanji. You should be able to read this on your own. Will help to know the reading of <jp>携帯</jp>.	[sound:Vocab-けいたいすとらっぷ-Male.mp3],None	[sound:Vocab-けいたいすとらっぷ-Female.mp3],None	The cell phone strap is so gross just thinking about it makes me puke.	<jp>あの携帯ストラップが気色悪すぎて、考えるだけでも吐きそうだわ。</jp>	None	None	None	None	None	None
4	竹の子	Bamboo Shoot,Bamboo Sprout	Bamboo,Child	竹,子	"What is a <kanji>child</kanji> of <kanji>bamboo</kanji>? That would be a baby bamboo. Because ""baby bamboo"" doesn't really make sense, we'll instead call this word <vocabulary>bamboo shoots</vocabulary>. P.S. Fresh bamboo shoots cooked on a fire are delicious, make sure you try them sometime."	noun	<reading><jp>たけのこ</jp></reading>	たけのこ	If you know the readings of the kanji for <jp>竹</jp> and the vocabulary for <jp>子</jp> you should be able to read this word as well.	[sound:Vocab-たけのこ-Male.mp3]	[sound:Vocab-たけのこ-Female.mp3]	I’m boiling bamboo shoots.	<jp>竹の子をゆでているところです。</jp>	If you go up north from the entrance of Mt. Fuji, there is a place where you can dig up a lot of bamboo shoots on your way.	<jp>ふじ山の入り口から北の方にのぼっていくと、と中に竹の子が山のようにとれるところがあります。</jp>	"""Hey, man. It’s cool, it’s cool. Take all the bamboo shoots you want,"" said the panda."	<jp>「あ、お兄さん。わかりました。わかりました。竹の子、好きなだけ持って行ってください。」とパンダが言った。</jp>	None	None
4	耳	Ear,Ears	Ear	耳	The kanji and the word are exactly the same. That means they share meanings as well.	noun	<reading><jp>みみ</jp></reading>	みみ	Since this word is made up of a single kanji, it should use the kun'yomi reading which is the reading you learned with the kanji. So you should be able to read this word already.	[sound:Vocab-みみ-Male.mp3]	[sound:Vocab-みみ-Female.mp3]	This cat’s ears are brown.	<jp>このねこの耳はちゃいろです。</jp>	I love bread crusts.	<jp>パンの耳はわたしの大こうぶつです。</jp>	I named my left ear Mimi. My right ear doesn’t hear very well, so I named it Mama.	<jp>わたしは、左耳をミミと名付けた。右耳はよく聞こえないので、ママと名付けた。</jp>	None	None
9	和食	Japanese Style Food,Japanese Food	Peace,Eat	和,食	"<kanji>Japanese style</kanji> <kanji>eat</kanji> ... well, let's change ""eat"" to ""food"" and you have <vocabulary>Japanese style food</vocabulary>. This is a good way to differentiate between an American style restaurant and a Japanese style restaurant. What kind of food you feeling like tonight? Oh, how about some <jp>和食</jp>?"	noun	<reading><jp>わしょく</jp></reading>	わしょく	This is a jukugo word, which usually means on'yomi readings from the kanji. If you know the readings of your kanji you'll know how to read this as well.	[sound:Vocab-わしょく-Male.mp3]	[sound:Vocab-わしょく-Female.mp3]	Well I like having Japanese style food for breakfast.	<jp>朝ごはんは、和食がいいですね。</jp>	There's been an increase in Americans who prefer Japanese cuisine to Western cuisine.	<jp>アメリカ人の中にもさい近、よう食よりも和食がすきな人がふえている。</jp>	Japanese style food doesn’t always mean sushi.	<jp>和食イコール寿司ってわけじゃない。</jp>	None	None
4	虫	Bug,Insect	Insect	虫	The kanji and the word are exactly the same. That means they share meanings as well.	noun	<reading><jp>むし</jp></reading>	むし	Since this word is made up of a single kanji, it should use the kun'yomi reading, which is also the reading you learned when you learned this kanji!	[sound:Vocab-むし-Male.mp3]	[sound:Vocab-むし-Female.mp3]	I don’t like bugs.	<jp>虫はにが手です。</jp>	That insect is spinning white thread from its mouth.	<jp>あの虫、口から白い糸をはいているよ！</jp>	No, that bug doesn’t bite. However, I will bite you if you still kill it.	<jp>ううん。その虫は噛まないよ。でも、もし君がそれでもそいつを殺すって言うなら、僕が君のことを噛むよ。</jp>	None	None
9	和服	Japanese Style Clothes,Japanese Clothing,Japanese Style Clothing,Japanese Clothes	Peace,Clothes	和,服	"<kanji>Japanese style</kanji> <kanji>clothes</kanji> (<vocabulary>Japanese Style Clothes</vocabulary>). We're talking kimonos and yukata and things like that. Basically, this differentiates Japanese clothing from Western clothing. <br><br>

What kind of clothes will you wear to the festival tonight? Oh, probably some <jp>和服</jp>."	noun	<reading><jp>わふく</jp></reading>	わふく	This is a jukugo word, which usually means on'yomi readings from the kanji. If you know the readings of your kanji you'll know how to read this as well.	[sound:Vocab-わふく-Male.mp3]	[sound:Vocab-わふく-Female.mp3]	You look good in Japanese style clothes too.	<jp>和服もに合ってるね。</jp>	How many Japanese style clothes do you have?	<jp>何ちゃく和服をもっていますか？</jp>	Have you seen Japanese people running marathons in Japanese style clothes?	<jp>和服でマラソンをする日本人を見たことがありますか？</jp>	None	None
24	副大統領	Vice President	Vice,Big,Unite,Territory	副,大,統,領	You know about <jp>大統領</jp> (<kanji>president</kanji>), right? Well, this is the <kanji>vice</kanji> version of the president, aka the <vocabulary>vice president</vocabulary>.	noun	<reading><jp>ふくだいとうりょう</jp></reading>	ふくだいとうりょう	This is a jukugo word, which usually means on'yomi readings from the kanji. If you know the readings of your kanji you'll know how to read this as well. It will help if you know the word <jp>大統領</jp> first, though.	[sound:Vocab-ふくだいとうりょう-Male.mp3]	[sound:Vocab-ふくだいとうりょう-Female.mp3]	I think we should give it a try. You may not become the president, but maybe you’ll become the vice president.	<jp>やってみるべきだと思うけど。大統領は無理でも、副大統領ぐらいなら狙えるんじゃない？</jp>	None	None	None	None	None	None
40	膝小僧	Kneecap	Knee,Small,Priest	膝,小,僧	"In your <kanji>knee</kanji> there is a <kanji>small</kanji> <kanji>priest</kanji> named <vocabulary>Kneecap</vocabulary>.<br><br>

This is a really common, cute way of talking about your kneecap. It's usually used by kids and adults alike, and it's more common in spoken Japanese than <jp>膝頭</jp>. Kind of like how we use ""kneecap"" instead of naming the ""patella"" bone all the time."	noun	<reading><jp>ひざこぞう</jp></reading>	ひざこぞう	This word uses the kun'yomi readings for <jp>膝小</jp> plus the on'yomi reading for <jp>僧</jp>. You've learned them all already, so you should be able to read this as long as you remember them all.	[sound:Vocab-ひざこぞう-Male.mp3]	[sound:Vocab-ひざこぞう-Female.mp3]	I fell off my bike and my kneecap hurts.	<jp>自転車で転んで、膝小僧が痛い。</jp>	I recently got a tattoo on my right kneecap.	<jp>最近、右の膝小僧にタトゥーを入れたんです。</jp>	How's your kneecap?	<jp>膝小僧の調子はどうですか？</jp>	None	None
4	村	Village,Rural Town	Village	村	The kanji and the word are exactly the same. That means they share meanings as well.	noun	<reading><jp>むら</jp></reading>	むら	Since this word is made up of a single kanji, it should use the kun'yomi reading. This is the reading you learned already with the kanji. Huzzah!	[sound:Vocab-むら-Male.mp3]	[sound:Vocab-むら-Female.mp3]	There is a village nearby.	<jp>ちかくに村があります。</jp>	Your mother was born in this village.	<jp>あなたのお母さんはこの村で生まれたのよ。</jp>	Yes, I have definitely stepped in the horse poop in your village.	<jp>ええ、私はあなたの村で一度本当に馬糞を踏んでしまったんです。</jp>	None	None
4	村人	Villager	Village,Person	村,人	You have a <kanji>village</kanji> <kanji>person</kanji>. That isn't someone dancing while wearing construction worker clothes, that's a <vocabulary>villager</vocabulary>.	noun	<reading><jp>むらびと</jp></reading>	むらびと	This word uses double kun'yomi for its reading, probably because it's like two separate words (village and person) put together into one big word. You should know these two kun'yomi readings (it's the main reading for <jp>村</jp> that you learned and you should know <jp>人</jp> by now), though you will need to look out for the rendaku'd <reading><jp>びと</jp></reading> reading.	[sound:Vocab-むらびと-Male.mp3]	[sound:Vocab-むらびと-Female.mp3]	The villagers are all old people.	<jp>村人は、年よりばかりです。</jp>	That line is kinda like something a villager would say in a fantasy game, isn't it?	<jp>なんかファンタジーゲームの村人っぽいセリフだよね。</jp>	"Pessimists say, ""the glass is half empty,"" but the villager surprised me by shouting ""Refill!"""	<jp>悲観主義者は「もうコップ半分しかない」と言うが、その村人は「おかわり！」と言って私を驚かせた。</jp>	None	None
12	第一	The First,First,Number One,Best	Ordinal Nu...,One	第,一	The <kanji>ordinal number prefix</kanji> <kanji>one</kanji> refers to <vocabulary>the first</vocabulary> thing. This is the <vocabulary>number one</vocabulary> place you can get. In fact, it's simply the <vocabulary>best</vocabulary>.	adverb,noun	<reading><jp>だいいち</jp></reading>	だいいち	This is a jukugo word, which usually means on'yomi readings from the kanji. If you know the readings of your kanji you'll know how to read this as well.	[sound:Vocab-だいいち-Male.mp3]	[sound:Vocab-だいいち-Female.mp3]	You should put your health first.	<jp>自分のけんこうが第一ですよ。</jp>	My first preference is Feb 14th and my second preference is Feb 21st.	<jp>第一きぼうは二月十四日で、第二きぼうは二月二十一日です。</jp>	What was your first impression of the famous blowfish family?	<jp>あの有名なフグ一家の第一印象はどうでしたか？</jp>	None	None
9	予定	Plan,Schedule,Estimate	Beforehand,Determine	予,定	Something has been <kanji>determine</kanji>d <kanji>beforehand</kanji>. What is this thing? This action? It is a <vocabulary>plan</vocabulary>.	noun,する verb	<reading><jp>よてい</jp></reading>	よてい	This is a jukugo word, which usually means on'yomi readings from the kanji. If you know the readings of your kanji you'll know how to read this as well.	[sound:Vocab-よてい-Male.mp3]	[sound:Vocab-よてい-Female.mp3]	Hey, can I make plans on Sunday?	<jp>ねえ、日よう日、予定を入れてもいい？</jp>	The asteroid is on a direct path to Earth and is estimated to hit somewhere in the North Atlantic Ocean.	<jp>その小わく星は地きゅうに向かっていて、北大西ようのどこかにしょうとつする予定だ。</jp>	I hate when I schedule out my day, but nobody follows the script.	<jp>私がせっかく予定を立てても、誰もその通りに動いてくれないことが嫌です。</jp>	None	None
4	花見	Viewing Cherry Blossoms,Sakura Viewing,Cherry Blossom Viewing	Flower,See	花,見	When you have <kanji>flower</kanji>s that you <kanji>see</kanji> you are viewing flowers. But not just any flowers. What flowers do Japanese people love viewing? That's right, this word refers to <vocabulary>viewing cherry blossoms</vocabulary>.	noun,する verb	<reading><jp>はなみ</jp></reading>	はなみ	The reading for this vocab is all kun'yomi, but you learned the kun'yomi readings of both these when you learned their kanji. So no worries there. You can spend the extra time viewing the cherry blossoms.	[sound:Vocab-はなみ-Male.mp3]	[sound:Vocab-はなみ-Female.mp3]	I didn’t go sakura viewing this year.	<jp>ことしは花見にいかなかった。</jp>	I'm gonna introduce you to the best cherry blossom viewing spots in Hokuriku region.	<jp>北りくち方の花見の名しょをごしょうかいします。</jp>	Before I die, I want to have a drinking party under the cherry blossoms one more time.	<jp>死ぬ前にもう一度花見をしながら宴会がしたいなあ。</jp>	None	None
12	短い	Short	Short	短	This is a single kanji with an <jp>い</jp> on the end, meaning you know it's probably an adjective. What's the adjective form of <kanji>short</kanji>? It's <vocabulary>short</vocabulary>.	い adjective	<reading><jp>みじかい</jp></reading>	みじかい	"Since this word consists of a kanji with hiragana attached, you can bet that it will use the kun'yomi reading. You didn't learn that reading with this kanji, so here's a mnemonic to help you: <br><br>

What's a very <vocabulary>short</vocabulary> race? A <reading>midge</reading>t <reading>ca</reading>r (<jp>みじか</jp>) race. Don't tell me you've never heard of midget car racing."	[sound:Vocab-みじかい-Male.mp3]	[sound:Vocab-みじかい-Female.mp3]	Isn't that skirt a bit too short?	<jp>そのスカート、ちょっと短すぎるんじゃない？</jp>	The baby's short, flailing arms and legs are so cute!	<jp>赤ちゃんが短い手足をバタバタさせてるのは本当にかわいい。</jp>	Wah! I didn’t know your tail was shorter than mine.	<jp>わぁ！あんたの尻尾が私より短いなんて、知らなかったわ。</jp>	None	None
12	起こる	To Occur,To Happen,To Take Place	Wake Up	起	"You know that <jp>起きる</jp> means ""to wake up."" This word, however, means <vocabulary>to occur</vocabulary>. Think of it this way. When an action ""wakes up"" in a way it is occurring as well. That's why this word means <vocabulary>to occur</vocabulary>. Just imagine a <reading>core</reading> (<jp>こる</jp>) of uranium just occurring out of nowhere to help you to remember this word."	intransitive verb,godan verb	<reading><jp>おこる</jp></reading>	おこる	The reading is the same as what you learned with the kanji and the same as <jp>起きる</jp> too, meaning you should be able to put together the reading on your own.	[sound:Vocab-おこる-Male.mp3]	[sound:Vocab-おこる-Female.mp3]	I never expected something like this would happen.	<jp>まさかこんなことが起こるなんて、思ってもみなかったよ。</jp>	Please calm down and think carefully about what's taken place.	<jp>今起こったことについて、落ち着いてよく考えてみてください。</jp>	"""Hey, do you want to kiss me?"" ""Absolutely no way would I ever want to kiss you in a million years. That would never happen even if heaven and earth were turned upside down."""	<jp>「ねぇ、僕にキスしたい？」「ありえない。100万年経ってもあんたとキスなんて絶対にしたくないから。天地がひっくり返っても、起こりっこないよ。」</jp>	None	None
44	挨拶	Greeting,Salutation,Speech 	Push Open,Draw Close	挨,拶	<kanji>Push open</kanji> the door to the conversation that is going to <kanji>be imminent</kanji> by saying the proper <vocabulary>greeting</vocabulary> or <vocabulary>salutation</vocabulary>. This word might also refer to a short <vocabulary>speech</vocabulary> you give at an event or ceremony.	noun,する verb,の adjective	<reading><jp>あいさつ</jp></reading>	あいさつ	This is a jukugo word that uses the on'yomi readings of the kanji. You've learned them already, so you should be able to read this on your own!	[sound:Vocab-あいさつ-Male.mp3]	[sound:Vocab-あいさつ-Female.mp3]	You're such a good child for greeting people properly even though you're still so little.	<jp>まだ小さいのに挨拶ができて良い子だね。</jp>	Greetings are an essential part of communication.	<jp>挨拶はコミュニケーションに欠かせない要素です。</jp>	I was in the area, so I came by to say hi.	<jp>近くにいたので、挨拶しに来ました。</jp>	None	None
5	見える	To Be Seen,To Be Visible,To Seem	See	見	"This word consists of kanji with hiragana attached. Because the hiragana ends with an <jp>う</jp> sound, you know this word is a verb. The kanji itself means <kanji>see</kanji>. <jp>見る</jp> means ""to see,"" and <jp>見える</jp> is <vocabulary>to be seen</vocabulary> or <vocabulary>to seem</vocabulary>. The ""to be seen"" meaning makes sense. The ""to seem"" meaning is a little odd, but if you think about it, you can figure it out. You have to see something to know what it seems like, which is why this also means ""to seem.""<br><br>

Note: <jp>見える</jp> could also be the potential form of <jp>見る</jp>. In that context, this word would also mean things like ""can see"" or ""visible."" You won't get this word wrong if you put those in, but since this is a vocabulary word we're not actually looking for conjugations here."	intransitive verb,ichidan verb	<reading><jp>みえる</jp></reading>	みえる	The reading for this word is the same as the one you learned with the kanji (the kun'yomi reading). So as long as you know that you should be able to read this word as well.	[sound:Vocab-みえる-Male.mp3]	[sound:Vocab-みえる-Female.mp3]	Can you see the red flag over there?	<jp>あそこの赤いはたが見えますか。</jp>	I can't help thinking about how I seem to others.	<jp>他人からどう見えるのかがすごく気になってし方がない。</jp>	The sun was so bright, I could barely see how high the balloon had risen.	<jp>太陽が眩しくて、風船がどのくらいの高さまで上がっていったのかほとんど見えなかった。</jp>	None	None
4	見せる	To Show	See	見	"This word consists of kanji with hiragana attached. Because the hiragana ends with an <jp>う</jp> sound, you know this word is a verb. It's related to the meaning of the kanji <jp>見</jp> ""see,"" but this one is about having someone else see something. In other words, it means <vocabulary>to show</vocabulary>. "	transitive verb,ichidan verb	<reading><jp>みせる</jp></reading>	みせる	The reading for this word is the same as the one that you learned with the kanji, so you should be able to read it.	[sound:Vocab-みせる-Male.mp3]	[sound:Vocab-みせる-Female.mp3]	What picture did the shop worker show the woman?	<jp>みせの人は、なんのえを女の人に見せましたか？</jp>	It seems tops that show a bit of skin are popular this summer.	<jp>今年のなつは、すはだをチラリと見せるトップスが人気のようです。</jp>	If I win this poker game, I’ll show you guys my Charizard card.	<jp>もし俺がこのポーカーゲームでかったら、お前らに俺のリザードンのカードを見せてやるよ。</jp>	None	None
12	東京都	Tokyo Metropolis,Tokyo Metro,Tokyo Metropolitan Area,Tokyo Metro Area	East,Capital,Metropolis	東,京,都	"The <kanji>Tokyo</kanji> <kanji>Metropolis</kanji> is, of course, the <vocabulary>Tokyo Metropolis</vocabulary>. Technically this is one of Japan's prefectures, but it's called a ""Metropolis"" instead. It's the capital and the largest city in all of Japan! "	proper noun	<reading><jp>とうきょうと</jp></reading>	とうきょうと	The reading is just <jp>東京</jp> and <jp>都</jp> (<jp>と</jp>). Really it's all just the reading you learned with the kanji, too, so you can think of it that way as well.	[sound:Vocab-とうきょうと-Male.mp3]	[sound:Vocab-とうきょうと-Female.mp3]	There are a lot of first-rate restaurants in the Tokyo Metropolitan Area.	<jp>東京都には、一流のレストランがたくさんある。</jp>	Taro Yamada (pseudonym), who is in his 30s and a salaryman in the Tokyo Metropolis, is working in an industry that is notorious for its hard work and long working hours.	<jp>東京都の３０代会社員、山田太ろうさん（仮名）は、げきむと長時間ろうどうで知られるぎょうかいで働いています。</jp>	The leaves started falling earlier this year than last year in Tokyo Metro’s Sumida Ward, where the Tokyo Sky Tree stands.	<jp>スカイツリーがそびえ立つ東京都墨田区では、今年は昨年よりも早く木の葉が落ち始めた。</jp>	None	None
18	叩く	To Strike,To Beat,To Hit,To Knock	Strike	叩	This word consists of kanji with hiragana attached. Because the hiragana ends with an <jp>う</jp> sound, you know this word is a verb. The kanji itself means <kanji>strike</kanji> or <kanji>beat</kanji>, so the verb version is <vocabulary>to strike</vocabulary> or <vocabulary>to beat</vocabulary>.	transitive verb,godan verb	<reading><jp>たたく</jp></reading>	たたく	"Since this word consists of a kanji with hiragana attached, you can bet that it will use the kun'yomi reading. You haven't learned this reading yet, so here's a mnemonic to help you:<br><br>

When you're going <vocabulary>to strike</vocabulary> something over and over it makes a <reading>ta-ta</reading> (<jp>たた</jp>) sound. Imagine you're about to beat a steel drum, for example. Now listen... <jp>たた</jp>! There! Did you hear it?"	[sound:Vocab-たたく-Male.mp3]	[sound:Vocab-たたく-Female.mp3]	You have a talent for beating drums.	<jp>ドラムを叩く才能がありますね。</jp>	Didn't I tell you to knock before opening the door?!	<jp>開ける前に、ドアを叩いてって言ったよね！？</jp>	Being hit with spiked bats really hurts!	<jp>釘バットで叩かれるのって、本当に痛い！</jp>	None	None
4	見方	Way Of Seeing,Point Of View,Perspective,Viewpoint	See,Direction	見,方	"The <kanji>way</kanji> you <kanji>see</kanji> is the <vocabulary>way of seeing</vocabulary> something. This is like when someone has a dumb opinion and you're like ""oh, okay, so that's one way of seeing it..."""	noun	<reading><jp>みかた</jp></reading>	みかた	This word uses the readings of the kanji you've already learned, even though they're kun'yomi.	[sound:Vocab-みかた-Male.mp3]	[sound:Vocab-みかた-Female.mp3]	I don't know how to look at this chart.	<jp>このひょうの見方が分かりません。</jp>	There are various ways of seeing and understanding.	<jp>いろんな見方やとらえ方があります。</jp>	If you look at it from a different point of view, we could consider Tofugu to be tofu that's fugu flavor.	<jp>別の見方をすれば、トーフグは河豚味の豆腐だと考えることもできる。</jp>	None	None
