Level	Symbol	Meaning	Kanji Component Name	Kanji Component Symbol	Meaning Mnemonic	Word Type	Reading	Reading Whitelist	Reading Mnemonic	Reading Audio Male	Reading Audio Female	Context 1-EN	Context 1-JP	Context 2-EN	Context 2-JP	Context 3-EN	Context 3-JP	Context 4-EN	Context 4-JP
29	居眠り	Nap,Doze,Dozing,Nodding Off,Dozing Off	居,眠	Alive,Sleep	Sometimes even though you're very much awake and <kanji>alive</kanji> you need to <kanji>sleep</kanji> for a little bit, so you take a <vocabulary>nap</vocabulary>. But you're not dead! You're totally alive, so let's hope no one thinks you're doing anything but <vocabulary>dozing off</vocabulary>.	noun,する verb	<reading><jp>いねむり</jp></reading>	いねむり	The readings for this word are both kun'yomi readings. You've learned both of these readings by now so you should be able to read this on your own.	[sound:Vocab-いねむり-Male.mp3]	[sound:Vocab-いねむり-Female.mp3]	It seems like they dozed off while driving.	<jp>運転中に居眠りしてたみたいなんだ。</jp>	None	None	None	None	None	None
34	損害	Damage,Injury	損,害	Loss,Damage	"Your <kanji>loss</kanji> comes from <kanji>damage</kanji> done to you. This is <vocabulary>damage</vocabulary>.

This word is usually used as a noun. It can occasionally be turned into verb by adding <jp>する</jp>, but this is very rare!"	noun,する verb	<reading><jp>そんがい</jp></reading>	そんがい	This is a jukugo word that uses the on'yomi readings of the kanji. You should be able to read this on your own.	[sound:Vocab-そんがい-Male.mp3]	[sound:Vocab-そんがい-Female.mp3]	The truck crash damaged the cargo, but it was only minor damage.	<jp>トラックの衝突で積荷がダメージを受けたが、小さな損害で済んだ。</jp>	None	None	None	None	None	None
30	痛める	To Injure Something,To Hurt Someone	痛	Pain	"This word consists of kanji with hiragana attached. Because the hiragana ends with an <jp>う</jp> sound, you know this word is a verb. 

The kanji itself means <kanji>pain</kanji>, and this verb is transitive, so it means to inflict pain. In other words, it's <vocabulary>to injure something</vocabulary> or <vocabulary>to hurt someone</vocabulary>."	transitive verb,ichidan verb	<reading><jp>いためる</jp></reading>	いためる	Since this word has okurigana (hiragana attached to the kanji) you know that it's probably going to be the kun'yomi reading. You learned that reading with the word <jp>痛い</jp>.	[sound:Vocab-いためる-Male.mp3]	[sound:Vocab-いためる-Female.mp3]	Playing games too much will hurt your eyes.	<jp>ゲームのやりすぎは目を痛める。</jp>	I ran a full marathon in slippers and injured my ankles.	<jp>スリッパでフルマラソンをしたら足首を痛めた。</jp>	That incident is still breaking mom's heart. 	<jp>母は今でもそのことで心を痛めている。</jp>	None	None
52	出没	Appearing Frequently,Infesting	出,没	Exit,Die	Animals <kanji>exit</kanji> the mountains into your land and never seem to <kanji>die</kanji>! They end up <vocabulary>appearing frequently</vocabulary> in your garden, eating all your yummy carrots and watermelons, and then make their exit back into the hills. They're <vocabulary>infesting</vocabulary> your home now and you don't know what to do!	noun,する verb	<reading><jp>しゅつぼつ</jp></reading>	しゅつぼつ	This is a jukugo word that uses the on'yomi readings of the kanji. You should be able to read this on your own.	[sound:Vocab-しゅつぼつ-Male.mp3]	[sound:Vocab-しゅつぼつ-Female.mp3]	Bears appear frequently in large quantities all over Japan.	<jp>日本各地でクマが大量出没している。</jp>	None	None	None	None	None	None
52	没収	Forfeiture,Seizure,Confiscation,Impounding	没,収	Die,Obtain	When you <kanji>obtain</kanji> something acting like that person had <kanji>die</kanji>d, it's called <vocabulary>confiscation</vocabulary> or <vocabulary>forfeiture</vocabulary>. Maybe if they were alive, you think, they wouldn't have let me take it. Well they are still alive so it's theirs and you can't keep it forever.	noun,する verb,の adjective	<reading><jp>ぼっしゅう</jp></reading>	ぼっしゅう	This is a jukugo word that uses the on'yomi readings of the kanji. You should be able to read this on your own.	[sound:Vocab-ぼっしゅう-Male.mp3]	[sound:Vocab-ぼっしゅう-Female.mp3]	I forfeited my cell phone to the teacher.	<jp>先生に携帯電話を没収されました。</jp>	None	None	None	None	None	None
57	色盲	Color Blindness	色,盲	Color,Blind	If you're only <kanji>blind</kanji> to <kanji>color</kanji> then you have <vocabulary>color blindness</vocabulary>.	noun,の adjective	<reading><jp>しきもう</jp></reading>	しきもう	This is a jukugo word that uses the on'yomi readings of the kanji. You should be able to read this on your own.	[sound:Vocab-しきもう-Male.mp3]	[sound:Vocab-しきもう-Female.mp3]	Can color-blindness be cured?	<jp>色盲って治るんですか。</jp>	None	None	None	None	None	None
29	恐ろしい	Scary,Fearful	恐	Fear	This is a single kanji with an <jp>い</jp> on the end, meaning you know it's probably an adjective. What's the adjective form of <kanji>fear</kanji>? When you feel fear, you think something is <vocabulary>scary</vocabulary>.	い adjective	<reading><jp>おそろしい</jp></reading>	おそろしい	Since this word consists of a kanji with hiragana attached, you can bet that it will use the kun'yomi reading. You didn't learn that reading with this kanji, so here's a mnemonic to help you: How <vocabulary>scary</vocabulary> is it? It's <reading>Oh so</reading> (<jp>おそ</jp>) scary!	[sound:Vocab-おそろしい-Male.mp3]	[sound:Vocab-おそろしい-Female.mp3]	You may feel scared, but you can’t defy the laws of nature. It’s no use now.	<jp>恐ろしいと思うかもしれないが、自然の法則には逆らえないんだよ。仕方がないさ。</jp>	None	None	None	None	None	None
57	敢然	Boldly,Bravely,Fearlessly	敢,然	Daring,Nature	If you have a <kanji>daring</kanji> <kanji>nature</kanji> you'll <vocabulary>boldly</vocabulary> go where no one else has gone before!	adjective,adverb,noun	<reading><jp>かんぜん</jp></reading>	かんぜん	This is a jukugo word that uses the on'yomi readings of the kanji. You should be able to read this on your own.	[sound:Vocab-かんぜん-Male.mp3]	[sound:Vocab-かんぜん-Female.mp3]	That man plans to boldly oppose the difficult situation with nothing but his own determination.	<jp>あの男は、まるで自分の意志で敢然と難局に立ち向かっているつもりなのよ。</jp>	None	None	None	None	None	None
32	背広	Business Suit	背,広	Back,Wide	If your <kanji>back</kanji> is <kanji>wide</kanji>, you need a nice <vocabulary>business suit</vocabulary> to cover it up when you go to work. Otherwise you'll look completely out of place sitting at a desk like a giant, wide-backed wrestler. Is that what you want to look like? Of course not! You need to go out and buy a fancy suit to cover your wide back up right now!	noun	<reading><jp>せびろ</jp></reading>	せびろ	The readings for this word are both kun'yomi readings. You've learned them both already so you should be able to read this too! Just watch out for the weird rendaku here making it <jp>び</jp> not <jp>ひ</jp>.	[sound:Vocab-せびろ-Male.mp3]	[sound:Vocab-せびろ-Female.mp3]	I lost a button from my suit.	<jp>背広のボタンをなくした。</jp>	None	None	None	None	None	None
11	進める	To Advance Something,To Move Something Forward	進	Advance	"This word consists of kanji with hiragana attached. Because the hiragana ends with an <jp>う</jp> sound, you know this word is a verb. The kanji itself means <kanji>advance</kanji>, and this verb means <vocabulary>to advance something</vocabulary> or <vocabulary>to move something forward</vocabulary>.

This is a transitive verb, so you act upon something else. You advance something. You move something forward. Like a school project, or your plans for taking over the world."	transitive verb,ichidan verb	<reading><jp>すすめる</jp></reading>	すすめる	"Since this word has okurigana (hiragana attached to the kanji) you know that it's probably going to be the kun'yomi reading, which you didn't learn with the kanji. Here's a mnemonic to help:

You are moving your lawsuit forward against Sue. But now she says that YOU'RE the problem. ""<reading>Sue, sue me</reading>,"" (<jp>すすめ</jp>) you say as you continue to advance the lawsuit. Make sure to say ""me"" like ""mehh,"" in a really snobbish way."	[sound:Vocab-すすめる-Male.mp3]	[sound:Vocab-すすめる-Female.mp3]	Thank you for giving us advice on advancing our research.	<jp>研究を進めるための助言をして下さって、ありがとうございます。</jp>	With this snow, we can't move the construction forward anymore.	<jp>この雪じゃ、これ以上工事を進められないよ。</jp>	Please move your work forward at the current pace. 	<jp>このペースで作業を進めてください。</jp>	None	None
52	噴出	Spewing,Gushing,Spouting,Eruption	噴,出	Erupt,Exit	When something <kanji>erupt</kanji>s out an <kanji>exit</kanji> it usually had to fight pretty hard to get to that exit. That's why it ends up <vocabulary>spewing</vocabulary> and <vocabulary>gushing</vocabulary> all over the place.	noun,する verb	<reading><jp>ふんしゅつ</jp></reading>	ふんしゅつ	This is a jukugo word that uses the on'yomi readings of the kanji. You should be able to read this on your own.	[sound:Vocab-ふんしゅつ-Male.mp3]	[sound:Vocab-ふんしゅつ-Female.mp3]	Is it true that gas spews out of black holes?	<jp>ブラックホールからガスが噴出しているって本当ですか？</jp>	None	None	None	None	None	None
52	猟犬	Hunting Dog,Hound	猟,犬	Hunting,Dog	A <kanji>hunting</kanji> <kanji>dog</kanji> is a <vocabulary>hunting dog</vocabulary>!	noun	<reading><jp>りょうけん</jp></reading>	りょうけん	"This is a jukugo word that uses the on'yomi readings of the kanji. You didn't learn this reading for <jp>犬</jp> yet, so here's a mnemonic to help you:

Who has the best <vocabulary>hunting dog</vocabulary> in the world? <reading>Ken</reading> (<jp>けん</jp>) from Street Fighter! His dog is also named Ken, because that's how Ken and Ken do things."	[sound:Vocab-りょうけん-Male.mp3]	[sound:Vocab-りょうけん-Female.mp3]	It’s said that hunting dogs typically bark a lot.	<jp>一般的に猟犬はよく吠えると言われています。</jp>	None	None	None	None	None	None
15	情けない	Miserable,Pitiable,Shameful,Deplorable,Wretched,Sad,Pitiful	情	Feeling	You've seen how the word <jp>情け</jp> means pity, so adding <jp>ない</jp> to that turns it into an adjective meaning <vocabulary>pitiable</vocabulary> and <vocabulary>miserable</vocabulary>. 	い adjective	<reading><jp>なさけない</jp></reading>	なさけない	Since this word consists of a kanji with hiragana attached, you can bet that it will use the kun'yomi reading. You learned this reading already so you should be able to read it!	[sound:Vocab-なさけない-Male.mp3]	[sound:Vocab-なさけない-Female.mp3]	It's sad, but I have a very trusting nature, so I often get duped.	<jp>情けないですが、すぐに人を信じる性格なので、よくだまされるんです。</jp>	It's shameful to get a job using connections. You should compete using your merits alone.	<jp>ツテでしゅうしょくするなんて、情けない。実力で勝負しろよ。</jp>	There really are a lot of deplorable Japanese politicians.	<jp>日本の政治家には、本当に情けない奴が多い。</jp>	None	None
52	密猟	Poaching	密,猟	Secrecy,Hunting	<kanji>Hunting</kanji> in <kanji>secrecy</kanji> is only done through illegal <vocabulary>poaching</vocabulary>. If you weren't poaching protected animals you wouldn't have to do it secretly. 	noun,する verb	<reading><jp>みつりょう</jp></reading>	みつりょう	This is a jukugo word that uses the on'yomi readings of the kanji. You should be able to read this on your own.	[sound:Vocab-みつりょう-Male.mp3]	[sound:Vocab-みつりょう-Female.mp3]	What do you think can be done to prevent the poaching of elephants?	<jp>どうすれば象の密猟を防止できると思いますか。</jp>	None	None	None	None	None	None
17	光栄	Honor,Privilege	光,栄	Sunlight,Prosper	"When a <kanji>light</kanji> shines on how much you've <kanji>prosper</kanji>ed, it's a great <vocabulary>honor</vocabulary>. You don't feel like you did anything so special, but it's really a privilege for the light to come down on you like this.

Don't confuse this with <jp>栄光</jp>! With that one, you made things prosper and the light came after, making you look glorious. With this, light is shining on you, and you receive honor from it."	noun,な adjective	<reading><jp>こうえい</jp></reading>	こうえい	This is a jukugo word, which usually means on'yomi readings from the kanji. If you know the readings of your kanji you'll know how to read this as well.	[sound:Vocab-こうえい-Male.mp3]	[sound:Vocab-こうえい-Female.mp3]	It's truly an honor for us to be able to interview you, Mr. Abe.	<jp>あべさんにインタビューさせていただけることをとても光栄に思っています。</jp>	You should know that it's indeed a privilege for you to chat with King Koichi in person.	<jp>コウイチ王と直せつお話ができることは、大変光栄なことなんですよ。</jp>	I’m deeply honored to have this opportunity to work at the Tofugu headquarters. I’ll do my best to be of use to you all.	<jp>Tofuguの本社で勤務する機会を頂いたことを、とても光栄に思います。皆さんのお役に立てるよう精一杯頑張りますので、どうぞよろしくお願いいたします。</jp>	None	None
17	原因	Cause,Origin,Source	原,因	Original,Cause	The <kanji>original</kanji> <kanji>cause</kanji> is how you got into this mess. Forget all the things it caused, the first <vocabulary>cause</vocabulary> is the <vocabulary>origin</vocabulary> and <vocabulary>source</vocabulary> of what's going on right now. You can pinpoint one thing that caused all of this!	noun,する verb	<reading><jp>げんいん</jp></reading>	げんいん	This is a jukugo word, which usually means on'yomi readings from the kanji. If you know the readings of your kanji you'll know how to read this as well.	[sound:Vocab-げんいん-Male.mp3]	[sound:Vocab-げんいん-Female.mp3]	Since we married for money, not for love, we fought a lot and ended up getting divorced.	<jp>愛情からではなく金のためにけっこんしたのが原因で、けんかがたえず、結局りこんしてしまいました。</jp>	Due to the wildfire of unknown origins, the town has been in such a chaotic situation.	<jp>原因不明の山火事で、町は大変なことになっています。</jp>	Don’t worry. Viet has already uncovered the cause of the bugs and is fixing it right now.	<jp>心配ないよ。ビエトがすでに不具合の原因を突き止めて、現在修復作業中だよ。</jp>	None	None
27	従える	To Be Accompanied By,To Preside Over,To Subdue	従	Obey	"This word consists of kanji with hiragana attached. Because the hiragana ends with an <jp>う</jp> sound, you know this word is a verb. 

The kanji itself means <kanji>obey</kanji>, and this verb is transitive, so some of its meanings refer to when you make someone obey you, or in other words <vocabulary>to preside over</vocabulary> or <vocabulary>to subdue</vocabulary>. Depending on the context though, it often just means <vocabulary>to be accompanied by</vocabulary> someone. To help you remember this, imagine that everyone you're accompanied by obeys you!"	transitive verb,ichidan verb	<reading><jp>したがえる</jp></reading>	したがえる	"Since this word has okurigana (hiragana attached to the kanji) you know that it's probably going to be the kun'yomi reading. You already learned this reading with 従う. Remember it?
"	[sound:Vocab-したがえる-Male.mp3]	[sound:Vocab-したがえる-Female.mp3]	The singer came here accompanied by her three bodyguards.	<jp>その歌手は三人のボディガードを従えてやってきた。</jp>	At the age of twenty, he was already a company president that presides over a hundred employees.	<jp>二十才の時には、すでに百人の社員を従える社長になっていた。</jp>	The oni subdued the villagers by force.	<jp>鬼は力で村人たちを従えた。</jp>	None	None
12	苦しめる	To Hurt Someone,To Torment,To Harass	苦	Suffering	"This word consists of kanji with hiragana attached. Because the hiragana ends with an <jp>う</jp> sound, you know this word is a verb. 

The kanji itself means <kanji>suffer</kanji>, and the verb is all about when you make someone else suffer. That's why it's <vocabulary>to hurt someone</vocabulary>, <vocabulary>to torment</vocabulary>, or <vocabulary>to harass</vocabulary>.

You need to differentiate this from <jp>苦しむ</jp>, which is about when YOU suffer. You can remember that <jp>苦しめる</jp> is about making someone else suffer with this mnemonic: Who made you suffer? She (<jp>し</jp>) made me (<jp>め</jp>) suffer! She's so mean!"	transitive verb,ichidan verb	<reading><jp>くるしめる</jp></reading>	くるしめる	"By now, you've learned 苦しい and 苦しむ. The kanji in these words all use the same reading! Yay! 
"	[sound:Vocab-くるしめる-Male.mp3]	[sound:Vocab-くるしめる-Female.mp3]	Don't hurt me anymore!	<jp>これ以上、私を苦しめないで！</jp>	The rice shortage is tormenting all citizens of Japan. 	<jp>米不足が全日本の国民を苦しめている。</jp>	Without realizing it, I was harassing the first-graders every day.	<jp>知らないうちに、毎日一年生を苦しめていた。</jp>	None	None
41	嘘吐き	Liar	嘘,吐	Lie,Throw Up	If <kanji>lies</kanji> puke (<jp>吐く</jp>) out of your mouth, you're a <vocabulary>liar</vocabulary>.	noun,の adjective	<reading><jp>うそつき</jp></reading>	うそつき	"This is a combination of the kun'yomi readings, one of which you haven't seen yet. You'll see this word without the <jp>吐</jp> kanji too, but for now let's learn its kanji reading! 

You can't just tell one <vocabulary>lie</vocabulary>, it always turns into <reading>two</reading> (<jp>つ</jp>). Kind of like a chip or pretzel, you can't just have one. With lies, you have to open your mouth for two more. And then two more.... and... well you get it."	[sound:Vocab-うそつき-Male.mp3]	[sound:Vocab-うそつき-Female.mp3]	Usopp is a liar.	<jp>ウソップは嘘吐きだ。</jp>	Apparently, Fuguko has a boyfriend who is a complete liar and they fight quite often.	<jp>フグ子ちゃん、大嘘つきの彼氏がいて、よくケンカするんだって。</jp>	In that era, all liars were to be burned.	<jp>その時代、嘘吐きは全員燃やされていた。</jp>	None	None
37	串	Skewer,Spit	串	Skewer	The kanji and the word are exactly the same.	noun	<reading><jp>くし</jp></reading>	くし	Since this word is made up of a single kanji, it probably uses the kun'yomi reading. You learned this reading with the kanji, so you should be able to read it already!	[sound:Vocab-くし-Male.mp3]	[sound:Vocab-くし-Female.mp3]	We need about a hundred skewers for the BBQ that's coming up.	<jp>今度のBBQには100本くらい串が必要です。</jp>	Could you skewer the meat and potatoes?	<jp>肉とジャガイモに串を刺してくれませんか？</jp>	Yakitori is chicken spitted on skewers.	<jp>焼き鳥とは、串に刺さった鶏肉のことです。</jp>	None	None
3	広げる	To Spread Something,To Unfold Something,To Open Something Up	広	Wide	"This word consists of kanji with hiragana attached. Because the hiragana ends with an <jp>う</jp> sound, you know this word is a verb. 

The kanji itself means <kanji>wide</kanji>, and the verb version is what happens when you try to make something wider. How do you make something wider? That's right, you have <vocabulary>to spread something</vocabulary>, <vocabulary>to unfold something</vocabulary> or <vocabulary>to open something up</vocabulary>. All of those actions will make a thing wider!

This is a transitive verb. That means it takes a direct object. You spread something. Like a newspaper, or a cloth on a table."	transitive verb,ichidan verb	<reading><jp>ひろげる</jp></reading>	ひろげる	"Since this word has okurigana (hiragana attached to the kanji) you know that it's probably going to be the kun'yomi reading. You learned this reading with the kanji, but here's a reminder mnemonic to help you:

You are going <vocabulary>to spread something</vocabulary>. What are you going to spread? How about your arms, so that you can fly into the sky like the super <reading>hero</reading> (<jp>ひろ</jp>) that you are! Most heroes can fly when they spread their arms wide!"	[sound:Vocab-ひろげる-Male.mp3]	[sound:Vocab-ひろげる-Female.mp3]	It was water that spread the virus in Japan.	<jp>日本にそのウィルスを広げたのは水だった。</jp>	Three adults unfolded a blanket.	<jp>大人三人でブランケットを広げた。</jp>	As soon as I went inside, I opened the book.	<jp>中に入ってすぐ本を広げた。</jp>	None	None
18	飴	Candy,Hard Candy,Sweets	飴	Candy	The kanji and the word are exactly the same. When we talk about this kind of <vocabulary>candy</vocabulary>, it's usually <vocabulary>hard candy</vocabulary> though. 🍬	noun	<reading><jp>あめ</jp></reading>	あめ	This word is made up of a single kanji, and it uses the kun'yomi reading. You learned this reading with the kanji, so you should be able to read it already!	[sound:Vocab-あめ-Male.mp3]	[sound:Vocab-あめ-Female.mp3]	Please give me a candy.	<jp>飴を一つ下さい。</jp>	Curry flavored candy has been trending in Japan.	<jp>日本では、カレー味の飴が流行っています。</jp>	Are you the type of person who sucks on candy or just swallows them?	<jp>飴は舐める派ですか？それとも飲み込む派？</jp>	None	None
22	諦観	Resignation	諦,観	Give Up,View	When you <kanji>give up</kanji> and just try to enjoy the <kanji>view</kanji>, that's <vocabulary>resignation</vocabulary>. You know things aren't going well, and you know you can't do anything about it now, so you resign yourself to what's to come.	noun,する verb	<reading><jp>ていかん</jp></reading>	ていかん	This is a jukugo word that uses the on'yomi readings of the kanji. You should be able to read this on your own.	[sound:Vocab-ていかん-Male.mp3]	[sound:Vocab-ていかん-Female.mp3]	My father's various experiences led to his resignation.	<jp>父は、様々な経験の後に諦観に至った。</jp>	Motivation became resignation before long.	<jp>やる気はやがて、諦観となった。</jp>	You are too young to be resigned.	<jp>君は諦観するにはまだ若い。</jp>	None	None
33	噂	Rumor,Gossip	噂	Rumor	The kanji and the word are exactly the same.	noun,する verb,の adjective	<reading><jp>うわさ</jp></reading>	うわさ	You learned this reading with the kanji, so you should be able to read it already!	[sound:Vocab-うわさ-Male.mp3]	[sound:Vocab-うわさ-Female.mp3]	There are rumors that the man named Cyrus is actually a robot.	<jp>サイラスというあの男は、実はロボットだという噂がある。</jp>	You really like to gossip, don't you?	<jp>あなたって本当、噂をするのが好きね。</jp>	"Do you wanna go to the izakaya ""Kagaya"" that everyone's talking about online?"	<jp>ネットで噂の「加賀屋」っていう居酒屋に行かない？</jp>	None	None
38	膝	Knee	膝	Knee	The kanji and the word are exactly the same.	noun	<reading><jp>ひざ</jp></reading>	ひざ	Since this word is made up of a single kanji, it probably uses the kun'yomi reading. You've learned them already, so you should be able to read this on your own!	[sound:Vocab-ひざ-Male.mp3]	[sound:Vocab-ひざ-Female.mp3]	I like eating pizza off my knees.	<jp>ピザを膝の上で食べるのが好きです。</jp>	Having a rental boyfriend propose on one knee costs an additional 100,000 yen.	<jp>レンタル彼氏に膝をついてプロポーズしてもらうには追加料金が10万円もかかる。</jp>	My mom is the knee-walking race world record holder.	<jp>私の母は膝で歩くレースの世界記録保持者だ。</jp>	None	None
