Level	Symbol	Meaning	Kanji Component Name	Kanji Component Symbol	Meaning Mnemonic	Word Type	Reading	Reading Whitelist	Reading Mnemonic	Reading Audio Male	Reading Audio Female	Context 1-EN	Context 1-JP	Context 2-EN	Context 2-JP	Context 3-EN	Context 3-JP	Context 4-EN	Context 4-JP
45	近頃	Lately,Recently	近,頃	Near,Approximate	The <kanji>near</kanji> <kanji>approximate</kanji> is the approximate time that was near to you. This period of time is the <vocabulary>lately</vocabulary> period of time. It's <vocabulary>recently</vocabulary>.	noun	<reading><jp>ちかごろ</jp></reading>	ちかごろ	The reading is <jp>近い</jp> and <jp>頃</jp> put together.	[sound:Vocab-ちかごろ-Male.mp3]	[sound:Vocab-ちかごろ-Female.mp3]	Recently I’ve been working the graveyard shift in a confectionery factory.	<jp>近頃は製菓工場で夜勤の仕事をしているんだ。</jp>	None	None	None	None	None	None
15	寺	Temple	寺	Temple	The kanji and the word are exactly the same. That means they share meanings as well.	noun	<reading><jp>てら</jp></reading>	てら	The reading is the same as the kanji too! You must have been praying to the kanji Gods at the local <jp>お寺</jp>.	[sound:Vocab-てら-Male.mp3]	[sound:Vocab-てら-Female.mp3]	Apparently, the body of someone who died accidentally was found at the temple last night.	<jp>昨夜、あのお寺で変死体が発見されたらしいよ。</jp>	I lived next to a temple when I was a child and it was really convenient for studying Buddhism.	<jp>子どものころ、寺のとなりに住んでいたので、仏教の勉強には大変都合が良かったんです。</jp>	I held a birthday party at one of the local temples in Japan. We got kicked out pretty quickly. I should have known that a temple wasn’t a good place to have a rock concert.	<jp>日本の地元のお寺で誕生日会を開いたんだけど、すぐに追い出されちゃった。お寺ってロック・コンサートをやる場所じゃないってこと、知っておけばよかったんだけど。</jp>	None	None
55	栃木県	Tochigi Prefecture	栃,木,県	Horse Ches...,Tree,Prefecture	The <kanji>prefecture</kanji> with lots of <kanji>horse chestnut</kanji> <kanji>tree</kanji>s is <vocabulary>Tochigi prefecture</vocabulary>.	noun	<reading><jp>とちぎけん</jp></reading>	とちぎけん	This word consists of the kun'yomi readings for <jp>栃</jp> and <jp>木</jp> and the on'yomi for <jp>県</jp>, like most with prefectures. As long as you remember that <jp>き</jp> is changed to <jp>ぎ</jp> here, you should be able to remember this reading easily!	[sound:Vocab-とちぎけん-Male.mp3]	[sound:Vocab-とちぎけん-Female.mp3]	Are you from Tochigi Prefecture?	<jp>栃木県の出身なんですか？</jp>	None	None	None	None	None	None
6	姉	Older Sister,Big Sister,Elder Sister	姉	Older Sister	The kanji and the word are exactly the same. That means they share meanings as well. This is your older sister, by the way. Not somebody else's.	noun	<reading><jp>あね</jp></reading>	あね	"Since this word is made up of a single kanji, it should use the kun'yomi reading. You haven't learned this reading yet,  so here's a mnemonic to help you remember:

Picture your <vocabulary>older sister</vocabulary> (even if you don't have one), her birthday is coming up and there's only one thing she wants from you. <reading>A ne</reading>cklace (<jp>あね</jp>). She's wanted a necklace for years and you're finally going to give her one. She'll be so happy."	[sound:Vocab-あね-Male.mp3]	[sound:Vocab-あね-Female.mp3]	I’m just about to go to my older sister’s house.	<jp>姉のいえに行くところです。</jp>	I have five times as many books as my older sister does.	<jp>わたしは、姉の五ばいのりょうの本をもっています。</jp>	My big sister works as a stewardess.	<jp>姉はスチュワーデスをしています。</jp>	None	None
50	無駄	Futility,Uselessness,Pointlessness	無,駄	Nothing,Burdensome	<kanji>Nothing</kanji> but <kanji>burdensome</kanji>. That's all you get out of doing this task. The <vocabulary>futility</vocabulary> of it is ridiculous. The <vocabulary>uselessness</vocabulary> is huge.	noun,な adjective	<reading><jp>むだ</jp></reading>	むだ	This is a jukugo word that uses the on'yomi readings of the kanji. You should be able to read this on your own.	[sound:Vocab-むだ-Male.mp3]	[sound:Vocab-むだ-Female.mp3]	Just saying it is useless. Fugu never listens to advice.	<jp>言うだけ無駄だよ。フグは決して忠告には耳を貸さないんだから。</jp>	None	None	None	None	None	None
45	遠距離	Long Distance	遠,距,離	Far,Distance,Detach	"A <kanji>far</kanji> <kanji>distance</kanji> <kanji>detach</kanji>ment is a distance that is far. It is <vocabulary>long distance</vocabulary>. Also remember that <jp>距離</jp> is a ""distance"" so a far distance is a <vocabulary>long distance</vocabulary>."	noun,の adjective	<reading><jp>えんきょり</jp></reading>	えんきょり	This is a jukugo word that uses the on'yomi readings of the kanji. You should be able to read this on your own.	[sound:Vocab-えんきょり-Male.mp3]	[sound:Vocab-えんきょり-Female.mp3]	In Japan, having a long distance commute to school or work is pretty common.	<jp>日本では、遠距離通学や遠距離通勤はよくあることです。</jp>	None	None	None	None	None	None
15	時計	Watch,Clock	時,計	Time,Measure	A thing that gives you <kanji>time</kanji> <kanji>measurement</kanji>s is a <vocabulary>watch</vocabulary> or <vocabulary>clock</vocabulary>. Most people have these in their phones instead of on their wrists now.	noun	<reading><jp>とけい</jp></reading>	とけい	The reading for this is pretty weird. <jp>計</jp> is all nice and normal, but <jp>時</jp> is <jp>と</jp> for some reason. It probably is coming from the vocab word <jp>時</jp> (<jp>とき</jp>), is my guess. But even if it is, it's shortened, making it a step more complicated. Maybe it's just better to imagine that your <vocabulary>watch</vocabulary> is a walky <reading>talky</reading> (<jp>とけい</jp>) and run with that?	[sound:Vocab-とけい-Male.mp3]	[sound:Vocab-とけい-Female.mp3]	Koichi dropped the clock Viet had given him from the ship.	<jp>コウイチはビエトにもらった時計を船から落としてしまいました。</jp>	We're gonna meet at the clock tower at 3 p.m., okay?	<jp>時計台の下で、三時に待ち合わせね！</jp>	Hey, isn’t that spit on your watch?	<jp>ねぇ、あなたの時計に唾が着いてない？</jp>	None	None
5	一回	One Time,Once	一,回	One,Times	<kanji>One</kanji> <kanji>times</kanji> is <vocabulary>one time</vocabulary>. How many times? Just one.	noun	<reading><jp>いっかい</jp></reading>	いっかい	This is a jukugo word, which usually means on'yomi readings from the kanji. If you know the readings of your kanji you'll know how to read this as well. Take note that <jp>一</jp> is shortened (as it often is) to <jp>いっ</jp>.	[sound:Vocab-いっかい-Male.mp3]	[sound:Vocab-いっかい-Female.mp3]	Please say it once more.	<jp>もう一回、言ってください。</jp>	I take a shower once a day during the week, but not at all over the weekend.	<jp>平日は一日に一回シャワーをあびますが、休日はぜんぜんあびません。</jp>	Do you want it one more time, honey?	<jp>もう一回欲しいのかい、ハニー？</jp>	None	None
56	裁縫	Sewing,Needlework	裁,縫	Judge,Sew	<kanji>Sew</kanji> so well that people will <kanji>judge</kanji> you to be the best and you'll be a champion at <vocabulary>sewing</vocabulary>!	noun,する verb	<reading><jp>さいほう</jp></reading>	さいほう	This is a jukugo word that uses the on'yomi readings of the kanji. You should be able to read this on your own.	[sound:Vocab-さいほう-Male.mp3]	[sound:Vocab-さいほう-Female.mp3]	Sewing really isn’t my strong point.	<jp>裁縫はあまり得意ではありません。</jp>	None	None	None	None	None	None
5	走る	To Run	走	Run	This word consists of kanji with hiragana attached. Because the hiragana ends with an <jp>う</jp> sound, you know this word is a verb. The kanji itself means <kanji>run</kanji> so now you know the verb version of that is <vocabulary>to run</vocabulary>.	intransitive verb,godan verb	<reading><jp>はしる</jp></reading>	はしる	"Since this word consists of a kanji with hiragana attached, you can bet that it will use the kun'yomi reading. You didn't learn that reading with this kanji, so here's a mnemonic to help you: 

You have to remember the <jp>はし</jp> portion. Think of yourself running. It's nice. As you run, though, you notice the ground changing into something weird and mushy. Everything is turning into <reading>hash</reading> (<jp>はし</jp>) browns. You start to get sucked in, and soon you can't run anymore. Smell the hash browns and taste them too. What a terrible run this was."	[sound:Vocab-はしる-Male.mp3]	[sound:Vocab-はしる-Female.mp3]	I ran because I was almost late for the movie.	<jp>えいがにおくれそうだったので、走りました。</jp>	Koichi can run faster than a turtle.	<jp>コウイチはカメよりもはやく走れる。</jp>	I’ve come to the conclusion that having my head cut off by a samurai would be much worse than running for my life.	<jp>人生走り続けるより、侍に首をはねられる方がずっとましだという結論に達しました。</jp>	None	None
56	所轄	Jurisdiction	所,轄	Place,Control	If you <kanji>place</kanji> <kanji>control</kanji> on someone you're giving them <vocabulary>jurisdiction</vocabulary> over whatever that thing is.	noun,する verb,の adjective	<reading><jp>しょかつ</jp></reading>	しょかつ	This is a jukugo word that uses the on'yomi readings of the kanji. You should be able to read this on your own.	[sound:Vocab-しょかつ-Male.mp3]	[sound:Vocab-しょかつ-Female.mp3]	Anyway, let’s get in contact with the police station with jurisdiction first. 	<jp>とにかく、まずは所轄の警察署に連絡をいれましょう。</jp>	None	None	None	None	None	None
33	異性	Different Gender,Opposite Sex	異,性	Differ,Gender	Someone who <kanji>differ</kanji>s in <kanji>gender</kanji> from you is of a <vocabulary>different gender</vocabulary>. This is often used to mean the <vocabulary>opposite sex</vocabulary> in the sense of men as viewed by women and vice versa.	noun,の adjective	<reading><jp>いせい</jp></reading>	いせい	This is a jukugo word that uses the on'yomi readings of the kanji. You should be able to read this on your own.	[sound:Vocab-いせい-Male.mp3]	[sound:Vocab-いせい-Female.mp3]	When I first learned about share houses, I thought it would be impossible for strangers of different genders to live together.	<jp>シェアハウスについて初めて知った時、知らない異性同士が暮らすなんてありえないと思いました。</jp>	Today, I talked to a person of the opposite sex for longer than usual.	<jp>今日は異性といつもより長く話しをしました。</jp>	Mika, you are too conscious of boys' muscles.	<jp>美果は、異性の筋肉を意識しすぎてるんだって。</jp>	None	None
24	境	Boundary	境	Boundary	The kanji and the word are exactly the same. That means they share meanings as well.	noun	<reading><jp>さかい</jp></reading>	さかい	Since this word is made up of a single kanji, it probably uses the kun'yomi reading. You did not learn this reading, so here's a mnemonic to help you to remember: You walk up to the boundary. You're there to pick something up to take it across. This thing you're smuggling across the boundary is a <reading>sockeye</reading> (<jp>さかい</jp>) salmon. You take it across the boundary and sell it for a big profit.	[sound:Vocab-さかい-Male.mp3]	[sound:Vocab-さかい-Female.mp3]	This river forms the boundary between the two states.	<jp>この川がちょうど両州の境となっているんですよ。</jp>	None	None	None	None	None	None
56	錯覚	Illusion,Optical Illusion	錯,覚	Mixed,Memorize	You thought you <kanji>memorize</kanji>d what this picture looked like, but suddenly everything looks <kanji>confused</kanji> and different. That's because it's an <vocabulary>illusion</vocabulary>.	noun,する verb,の adjective	<reading><jp>さっかく</jp></reading>	さっかく	This is a jukugo word that uses the on'yomi readings of the kanji. You should be able to read this on your own.	[sound:Vocab-さっかく-Male.mp3]	[sound:Vocab-さっかく-Female.mp3]	I was assailed by an illusion that looked just like me.	<jp>それがまるで自分のもののような錯覚に襲われたんです。</jp>	None	None	None	None	None	None
56	交錯	Mixture,Blending,Complication	交,錯	Mix,Mixed	You <kanji>confused</kanji> all of the ingredients to your cake by <kanji>mix</kanji>ing them together into one weird <vocabulary>mixture</vocabulary>.	noun,する verb	<reading><jp>こうさく</jp></reading>	こうさく	This is a jukugo word that uses the on'yomi readings of the kanji. You should be able to read this on your own.	[sound:Vocab-こうさく-Male.mp3]	[sound:Vocab-こうさく-Female.mp3]	Various emotions were mixed and we weren’t able to reach a conclusion.	<jp>色々な感情が交錯し、結論を出せずにいました。</jp>	None	None	None	None	None	None
33	編集する	To Edit	編,集	Knit,Collect	<jp>編集</jp> is <kanji>edit</kanji>, so the verb version is <vocabulary>to edit</vocabulary>.	する verb	<reading><jp>へんしゅうする</jp></reading>	へんしゅうする	This is a jukugo word that uses the on'yomi readings of the kanji. You should be able to read this on your own.	[sound:Vocab-へんしゅうする-Male.mp3]	[sound:Vocab-へんしゅうする-Female.mp3]	I’m editing a document summary in the office right now.	<jp>今オフィスで資料の要約を編集しているところよ。</jp>	None	None	None	None	None	None
28	逆効果	Opposite Effect	逆,効,果	Reverse,Effective,Fruit	"<jp>効果</jp> is ""effect,"" so the <kanji>opposite</kanji> of said effect is the <vocabulary>opposite effect</vocabulary>. Whoops!"	noun	<reading><jp>ぎゃくこうか</jp></reading>,<reading><jp>ぎゃっこうか</jp></reading>	ぎゃくこうか,ぎゃっこうか	This is a jukugo word, which usually means on'yomi readings from the kanji. If you know the readings of your kanji you'll know how to read this as  well. Will help to know <jp>効果</jp> as well.	[sound:Vocab-ぎゃくこうか-Male.mp3],None	[sound:Vocab-ぎゃくこうか-Female.mp3],None	I kissed that other girl to make my girlfriend jealous, but it really backfired.	<jp>彼女に焼き餅を妬かせようとして他の女にキスをしたら、全く逆効果になってしまった。</jp>	None	None	None	None	None	None
15	自信	Confidence,Self Confidence	自,信	Self,Believe	When you <kanji>believe</kanji> in your <kanji>self</kanji> you have plenty of <vocabulary>confidence</vocabulary> (or <vocabulary>self confidence</vocabulary>). This is a good thing to have!	noun,する verb	<reading><jp>じしん</jp></reading>	じしん	How much <jp>自信</jp> do you have that you know how to read this word already? I bet you have some, at least! This is a jukugo word, which usually means on'yomi readings from the kanji. If you know the readings of your kanji you'll know how to read this as well.	[sound:Vocab-じしん-Male.mp3]	[sound:Vocab-じしん-Female.mp3]	Koichi is quite the self-confident person.	<jp>コウイチは大変な自信家です。</jp>	You should have more confidence in yourself.	<jp>もっと自信を持った方がいいよ！</jp>	Viet said he was sure he could draw Koichi’s face better than anyone else because he knew him better than anyone else.	<jp>ビエトは、誰よりもコウイチのことをよく知っているので、誰よりもうまくコウイチの顔を描ける自信があると言っていた。</jp>	None	None
15	英和	English Japanese	英,和	England,Peace	This is seen on things like dictionaries. When you have an <kanji>English</kanji> and <kanji>Japanese</kanji> (style) dictionary, for example. You'll see it the other way around too, but this particular one is <vocabulary>English Japanese</vocabulary>.	noun	<reading><jp>えいわ</jp></reading>	えいわ	This is a jukugo word, which usually means on'yomi readings from the kanji. If you know the readings of your kanji you'll know how to read this as well.	[sound:Vocab-えいわ-Male.mp3]	[sound:Vocab-えいわ-Female.mp3]	I work as an English-Japanese translator.	<jp>英和ほんやくの仕事をしています。</jp>	A new English Japanese parallel translation book came out.	<jp>新しい英和対やくの本が出ました。</jp>	Uh-oh, Cameron's about to cry! Can you go find the English-Japanese dictionary and hand it to him?	<jp>おっと、キャメロンが泣きそうだ！ちょっとあの英和辞典を探して来て、キャメロンに渡してあげてくれない？</jp>	None	None
46	帝	Japanese Emperor,Emperor Of Japan	帝	Sovereign	The one true <kanji>sovereign</kanji> is the <vocabulary>Japanese Emperor</vocabulary>, aka the <vocabulary>Emperor of Japan</vocabulary>. All other emperors aren't simply <jp>帝</jp> on its own.	independent noun	<reading><jp>みかど</jp></reading>	みかど	"To remember the reading, think about how the <vocabulary>Japanese Emperor</vocabulary>, can always pull out his ""<reading>me card</reading>"" (<jp>みかど</jp>) when he's in trouble. It's kind of like how a ""trump card"" is the one that's above all the others, but with the emperor he's always up there, so it's a ""me card"" to him. And who's gonna argue with the emperor? Not me."	[sound:Vocab-みかど-Male.mp3]	[sound:Vocab-みかど-Female.mp3]	People hung the national flag for the Japanese Emperor’s visit.	<jp>人々は、帝がお出でになるということで、国旗を掲げました。</jp>	None	None	None	None	None	None
29	催告	Notification	催,告	Sponsor,Announce	When you <kanji>sponsor</kanji> an <kanji>announce</kanji>ment, you're allowing those you're sponsoring to create some kind of <vocabulary>notification</vocabulary> for all those they want to get in contact with.	noun,する verb	<reading><jp>さいこく</jp></reading>	さいこく	This is a jukugo word, which usually means on'yomi readings from the kanji. If you know the readings of your kanji you'll know how to read this as well.	[sound:Vocab-さいこく-Male.mp3]	[sound:Vocab-さいこく-Female.mp3]	A consumer credit company has been sending me notification letters over and over, demanding that I pay back my debt.	<jp>サラ金から、借金の返済を求める催告状が何度も何度も届いています。</jp>	None	None	None	None	None	None
46	鍵	Key,Lock	鍵	Key	The kanji and the word are exactly the same. That means they share meanings as well.	noun	<reading><jp>かぎ</jp></reading>	かぎ	The reading is the same as the one you learned with the kanji.	[sound:Vocab-かぎ-Male.mp3]	[sound:Vocab-かぎ-Female.mp3]	Well, I locked myself out of my car and am waiting for a locksmith to come.	<jp>いや〜鍵を中に置いたまま車に鍵をかけちゃってさ、今鍵屋さんが来るのを待ってるんだよ。</jp>	None	None	None	None	None	None
46	鈍い	Dull,Thickheaded	鈍	Dull	This is a single kanji with an <jp>い</jp> on the end, meaning you know it's probably an adjective. What's the adjective form of <kanji>dull</kanji>? It's <vocabulary>dull</vocabulary>.	い adjective	<reading><jp>にぶい</jp></reading>,<reading><jp>のろい</jp></reading>	にぶい,のろい	To remember the reading, think about how when you're i<reading>neb</reading>riated (<jp>にぶ</jp>) you need to use a <vocabulary>dull</vocabulary> knife. The <jp>にぶい</jp> reading talks about a thing that is dull. For <jp>のろい</jp>, which refers to a dull mind (someone who's <vocabulary>thickheaded</vocabulary>). Think about a <reading>Nor</reading>se (<jp>のろ</jp>) God, the God of dullbrains.	[sound:Vocab-にぶい-Male.mp3],[sound:Vocab-のろい-Male.mp3]	[sound:Vocab-にぶい-Female.mp3],[sound:Vocab-のろい-Female.mp3]	I’m pregnant and sometimes I feel a dull pain in my stomach. Is this normal?	<jp>現在妊娠中で、お腹に時々鈍い痛みを感じるんですが、これは普通ですか。</jp>	None	None	None	None	None	None
5	来月	Next Month	来,月	Come,Moon	The <kanji>next</kanji> <kanji>month</kanji> is the <vocabulary>next month</vocabulary>! It isn't this month or the month before, it's the next one!	noun	<reading><jp>らいげつ</jp></reading>	らいげつ	This is a jukugo word, which usually means on'yomi readings from the kanji. If you know the readings of your kanji you'll know how to read this as well.	[sound:Vocab-らいげつ-Male.mp3]	[sound:Vocab-らいげつ-Female.mp3]	I am having a birthday party next month, so please come too, Kanae.	<jp>来月たん生日会をするので、かなえさんも来てください。</jp>	What day next month is the day of the fireworks display?	<jp>花火大会の日は来月の何日でしたっけ？</jp>	Next month I’ll start scuba diving to find the glasses I lost at sea today.	<jp>今日海に落とした眼鏡を探すために、来月スキューバダイビングを始めることにしたよ。</jp>	None	None
6	小文字	Lowercase Letters,Lowercase Characters,Lowercase	小,文,字	Small,Writing,Letter	"You know that <jp>文字</jp> means ""letters"". So, what are ""small letters""? That would be <vocabulary>lowercase letters</vocabulary>."	noun	<reading><jp>こもじ</jp></reading>	こもじ	"The reading for <jp>小</jp> is an exceptional reading. You know it means ""small,"" so think about what else is small: a child. How do you say ""child"" in Japanese? <jp>こ</jp>. You also know how to say the <jp>文字</jp> portion from the previous level, so combine those together and you have <reading><jp>こもじ</jp></reading>."	[sound:Vocab-こもじ-Male.mp3]	[sound:Vocab-こもじ-Female.mp3]	How do you switch from lowercase to uppercase?	<jp>どうやって小文字と大文字を切りかえますか。</jp>	Passwords must contain at least one uppercase letter, one lowercase letter and a number.	<jp>パスワードには、かならず大文字、小文字、すう字を一つい上つかってください。</jp>	Is your email address in all lowercase letters? Is it really? Are you crazy?	<jp>君のEメールアドレスって、全部小文字なの？本当に？ちょっとおかしいんじゃないの？</jp>	None	None
15	英語	English Language,English	英,語	England,Language	The <kanji>English</kanji> <kanji>language</kanji> is the language you're reading right here and now. This is the <vocabulary>English language</vocabulary>. It is <vocabulary>English</vocabulary>.	noun,の adjective	<reading><jp>えいご</jp></reading>	えいご	This is a jukugo word, which usually means on'yomi readings from the kanji. If you know the readings of your kanji you'll know how to read this as well.	[sound:Vocab-えいご-Male.mp3]	[sound:Vocab-えいご-Female.mp3]	I think English pronunciation is more difficult than Japanese pronunciation.	<jp>英語の発音は日本語の発音よりむずかしいと思う。</jp>	If this restaurant's workers turn out to be able to speak English, we won't have to go all the way to the other one any more.	<jp>もしこのレストランの店員も英語が話せるようだったら、今後わざわざあの店まで行かなくてすむようになるね。</jp>	"""All of us hate our English and Math classes."" ""Hey, speak for yourself. I like both of them."""	<jp>「僕たちは皆、英語と数学の授業が嫌いだ。」「ちょっと、一緒にしないでよ。私は両方共好きだし。」</jp>	None	None
47	粘る	To Be Sticky,To Persevere	粘	Sticky	Because the hiragana ends with an <jp>う</jp> sound, you know this word is a verb. The kanji itself means <kanji>sticky</kanji> and the verb vocab version is <vocabulary>to be sticky</vocabulary>. It can also mean <vocabulary>to persevere</vocabulary>, because if you're being sticky towards the situation, not giving up and not letting go. You're totally persevering by sticking around.	intransitive verb,godan verb	<reading><jp>ねばる</jp></reading>	ねばる	Will I give up? I'll <reading>nevah</reading> (<jp>ねば</jp>) give up! I'll also <reading>nevah</reading> unstick from you.	[sound:Vocab-ねばる-Male.mp3]	[sound:Vocab-ねばる-Female.mp3]	Wow! That salesman is still talking to my mom. How persistent!	<jp>ええっ！あのセールスマンまだうちの母ちゃんと話をしてるよ。粘るね〜！</jp>	None	None	None	None	None	None
48	塗装	Coating,Painting	塗,装	Paint,Attire	With <kanji>paint</kanji> I want to <kanji>attire</kanji> the wall. Let's put a <vocabulary>coating</vocabulary> of <vocabulary>painting</vocabulary> up on the wall.	noun,する verb	<reading><jp>とそう</jp></reading>	とそう	This is a jukugo word that uses the on'yomi readings of the kanji. You should be able to read this on your own.	[sound:Vocab-とそう-Male.mp3]	[sound:Vocab-とそう-Female.mp3]	I am so sorry for being late. Painting my bathroom walls took me longer than I thought.	<jp>遅くなって、本当にすみません。トイレの壁の塗装が思ったよりも長引いてしまって。</jp>	None	None	None	None	None	None
