Level	Symbol	Meaning	Kanji Component Name	Kanji Component Symbol	Meaning Mnemonic	Word Type	Reading	Reading Whitelist	Reading Mnemonic	Reading Audio Male	Reading Audio Female	Context 1-EN	Context 1-JP	Context 2-EN	Context 2-JP	Context 3-EN	Context 3-JP	Context 4-EN	Context 4-JP
16	公園	Public Park,Park	Public,Garden	公,園	A <kanji>public</kanji> <kanji>park</kanji> is a park that is public. It's a <vocabulary>public park</vocabulary>.	noun	<reading><jp>こうえん</jp></reading>	こうえん	This is a jukugo word, which usually means on'yomi readings from the kanji. If you know the readings of your kanji you'll know how to read this as well.	[sound:Vocab-こうえん-Male.mp3]	[sound:Vocab-こうえん-Female.mp3]	If you go straight down this road, there’s a park.	<jp>この通りを真っ直ぐ行くと、公園があります。</jp>	I was playing with sand at a public park and it turned my hands as black as coal.	<jp>公園ですなあそびをしていたら、手が真っ黒になってしまった。</jp>	"""So, how was the park you and Fugu went to?"" ""That was actually the most enjoyable park we’ve ever been to."""	<jp>「フグと一緒にいった公園、どうだった？」「正直今までに行った公園の中で一番楽しかったよ。」</jp>	None	None
12	深い	Deep	Deep	深	This is a single kanji with an <jp>い</jp> on the end, meaning you know it's probably an adjective. What's the adjective form of <kanji>deep</kanji>? It's also <vocabulary>deep</vocabulary>.	い adjective	<reading><jp>ふかい</jp></reading>	ふかい	Since this word consists of a kanji with hiragana attached, you can bet that it will use the kun'yomi reading. Because the reading sounds just like a dirty word, and there may be innocent children about, I'll let you come up with your own mnemonic for this one. Maybe someone pushes you into a deep hole that will surely kill you so you yell something out as you fall down it?	[sound:Vocab-ふかい-Male.mp3]	[sound:Vocab-ふかい-Female.mp3]	The water suddenly got deep, eh?	<jp>水深が急に深くなりましたね。</jp>	I saw Koichi letting out a deep sigh, has something happened?	<jp>コウイチがデスクで深いため息をついてるのを見たんだけど、何かあったの？</jp>	Is it true that fish tend to maintain a deep connection with their parents, siblings, and high school friends?	<jp>魚たちが、親や兄弟、高校時代の友人たちとの深い繋がりを保っていることが多いって、本当ですか？</jp>	None	None
12	鳴き声	Animal Cry,Animal Sound,Animal Noise,Chirp,Tweet,Roar,Bark,Meow	Chirp,Voice	鳴,声	The <kanji>chirp</kanji> <kanji>voice</kanji> is a sound an animal makes. Sure, it works for birds (which chirp), but it also works with most other animals as well. So, we call this an <vocabulary>animal cry</vocabulary>.	noun	<reading><jp>なきごえ</jp></reading>	なきごえ	"The readings are those that you learned with the kanji. <jp>声</jp> gets changed to <jp>ごえ</jp>, though, so take note of that in your head. Perhaps you can imagine an animal that does a ""GOEEEEE"" cry."	[sound:Vocab-なきごえ-Male.mp3]	[sound:Vocab-なきごえ-Female.mp3]	Have you ever heard what a giraffe sounds like?	<jp>きりんの鳴き声を聞いたことがありますか。</jp>	I thought I heard Koichi outside, but it was a little bird's chirps.	<jp>外からコウイチの声が聞こえると思ったら、小鳥の鳴き声だった。</jp>	I hear a puppy barking under the vending machine.	<jp>自動販売機の下から子犬の鳴き声が聞こえるんです。</jp>	None	None
16	園	Garden,Park	Garden	園	The kanji and the word are exactly the same. That means they share meanings as well.	noun,suffix	<reading><jp>えん</jp></reading>,<reading><jp>その</jp></reading>	えん,その	Lucky you, the word garden is read the same way as the kanji is read. Kind of a Garden of Eden for kanji and vocab, no?	[sound:Vocab-えん-Male.mp3],[sound:Vocab-その-Male.mp3]	[sound:Vocab-えん-Female.mp3],[sound:Vocab-その-Female.mp3]	Laborers hardened the ground before building a daycare.	<jp>保育園を建てる前に、労働者たちが地面を固めました。</jp>	I had a part-time job where I packed apples in boxes at an apple orchard.	<jp>リンゴ農園でリンゴを箱づめするアルバイトをしていました。</jp>	I live near the botanical garden.	<jp>私は植物園の近くに住んでいます。</jp>	None	None
30	盗作	Plagiarism	Steal,Make	盗,作	<kanji>Steal</kanji> what other people <kanji>make</kanji>? Wow. Way to go. That is <vocabulary>plagiarism</vocabulary>.	noun,する verb	<reading><jp>とうさく</jp></reading>	とうさく	This is a jukugo word, which usually means on'yomi readings from the kanji. If you know the readings of your kanji you'll know how to read this as well.	[sound:Vocab-とうさく-Male.mp3]	[sound:Vocab-とうさく-Female.mp3]	If you stole someone else’s work, you could be sued for plagiarism.	<jp>他人の作品をパクったら、盗作で訴えられるかもしれないよ。</jp>	None	None	None	None	None	None
16	専門	Specialty,Speciality,Area Of Study,Major	Specialty,Gates	専,門	Your <kanji>specialty</kanji> <kanji>gate</kanji> is the thing you open to let out your <vocabulary>specialty</vocabulary>. Imagine the thing you're best at (your specialty). Now imagine opening a gate in your chest that lets it out, allowing you to be good at it.	noun,の adjective	<reading><jp>せんもん</jp></reading>	せんもん	This is a jukugo word, which usually means on'yomi readings from the kanji. If you know the readings of your kanji you'll know how to read this as well.	[sound:Vocab-せんもん-Male.mp3]	[sound:Vocab-せんもん-Female.mp3]	That's out of my area of study.	<jp>それは私の専門外です。</jp>	My older sister is a specialty pet eye doctor.	<jp>私の姉は、ペット専門の目医者です。</jp>	My specialty is astronomy. I want to discover new stars.	<jp>私の専門は天文学です。新しい星を発見したいです。</jp>	None	None
34	不純	Impure	Not,Pure	不,純	<kanji>Not</kanji> <kanji>pure</kanji> things are <vocabulary>impure</vocabulary>.	noun,な adjective	<reading><jp>ふじゅん</jp></reading>	ふじゅん	This is a jukugo word that uses the on'yomi readings of the kanji. You should be able to read this on your own.	[sound:Vocab-ふじゅん-Male.mp3]	[sound:Vocab-ふじゅん-Female.mp3]	I started studying Japanese out of impure motives.	<jp>私は不純な動機から日本語を勉強し始めました。</jp>	None	None	None	None	None	None
16	急死	Sudden Death	Hurry,Death	急,死	When someone experiences a <kanji>hurry</kanji> <kanji>death</kanji> it's a very <vocabulary>sudden death</vocabulary>.	noun,する verb	<reading><jp>きゅうし</jp></reading>	きゅうし	This is a jukugo word, which usually means on'yomi readings from the kanji. If you know the readings of your kanji you'll know how to read this as well.	[sound:Vocab-きゅうし-Male.mp3]	[sound:Vocab-きゅうし-Female.mp3]	I was preparing to take my exams when my dad suddenly passed away.	<jp>父が急死した時、私は受けん生でした。</jp>	My superior died suddenly of a cerebral hemorrhage yesterday.	<jp>昨日、上司が、のう出血のため急死しました。</jp>	I often argued with my boyfriend and I hated it, but I even miss the arguments now. I never expected that he would drop dead from a heart attack.	<jp>彼とはよく喧嘩になっちゃって、それが本当に嫌だったんだけど、今では喧嘩もできなくなっちゃってすっごく悲しいよ。まさか心臓発作で急死しちゃうなんて思ってもみなかったからさ。</jp>	None	None
25	効力	Effectiveness,In Effect	Effective,Power	効,力	Your <kanji>effective</kanji> <kanji>power</kanji> is your <vocabulary>effectiveness</vocabulary>.	noun	<reading><jp>こうりょく</jp></reading>	こうりょく	This is a jukugo word, which usually means on'yomi readings from the kanji. If you know the readings of your kanji you'll know how to read this as well.	[sound:Vocab-こうりょく-Male.mp3]	[sound:Vocab-こうりょく-Female.mp3]	Your presentation today seemed like it was a bit weaker in its effectiveness compared to the last one.	<jp>あなたの今日のプレゼンテーションは、前回に比べて効力が少し弱いような気がしました。</jp>	None	None	None	None	None	None
16	政治	Politics,Government	Politics,Cure	政,治	If you want to <kanji>cure</kanji> the <kanji>government</kanji>, you have to get into <vocabulary>politics</vocabulary>. Gotta join 'em to fix them... but can you survive that long without being corrupted yourself?	noun	<reading><jp>せいじ</jp></reading>	せいじ	This is a jukugo word, which usually means on'yomi readings from the kanji. If you know the readings of your kanji you'll know how to read this as well.	[sound:Vocab-せいじ-Male.mp3]	[sound:Vocab-せいじ-Female.mp3]	My long held hope, which was to study politics in university, finally came true.	<jp>ついに、大学で政治を学ぶという私の長年の希望がかないました。</jp>	Salmon's attitude toward the government is very conservative.	<jp>サーモンの政治に対する考えはとても保守的です。</jp>	Being mindful of the political turmoil occurring in Washington D.C., Tofugu has been creating employment for both the Republican and Democratic dominated regions.	<jp>ワシントンDCで起きている政治騒動なんてお構いなしに、トーフグは共和党と民主党の両地域で雇用を生み出している。</jp>	None	None
16	残品	Unsold Merchandise,Remaining Stock	Remainder,Product	残,品	The <kanji>remainder</kanji> <kanji>product</kanji>s are the things that haven't been sold. It's the <vocabulary>unsold merchandise</vocabulary>. It's the <vocabulary>remaining stock</vocabulary>.	noun	<reading><jp>ざんぴん</jp></reading>	ざんぴん	This is a jukugo word, which usually means on'yomi readings from the kanji. If you know the readings of your kanji you'll know how to read this as well. Note that <jp>ひん</jp> changes to <jp>ぴん</jp>.	[sound:Vocab-ざんぴん-Male.mp3]	[sound:Vocab-ざんぴん-Female.mp3]	We sold the remaining goods at half price.	<jp>残品は半がくでしょ分しました。</jp>	You can return any unsold stock, so would you let us sell our products here?	<jp>残品はこちらで引き取るので、こちらのお店ではん売させてもらえませんか。</jp>	Before we leave the store tonight, let’s go ahead and count the remaining stock.	<jp>今夜店を出発する前に残品を数えておきましょう。</jp>	None	None
55	鎮める	To Appease,To Suppress,To Calm	Tranquilize	鎮	This word consists of kanji with hiragana attached. Because the hiragana ends with an <jp>う</jp> sound, you know this word is a verb. The kanji itself means <kanji>tranquilize</kanji>, so the verb version is what happens when you've already been able to tranquilize someone. It's <vocabulary>to appease</vocabulary> or <vocabulary>to suppress</vocabulary>.	transitive verb,ichidan verb	<reading><jp>しずめる</jp></reading>	しずめる	"Since this word consists of a kanji with hiragana attached, you can bet that it will use the kun'yomi reading. You didn't learn that reading with this kanji, so here's a mnemonic to help you: <br><br>

You want <vocabulary>to appease</vocabulary> her because <reading>she's</reading> (<jp>しず</jp>) SUPER mad. She's pissed and she's angry and she's going to beat you up if you don't find out how <vocabulary>to calm</vocabulary> her down!"	[sound:Vocab-しずめる-Male.mp3]	[sound:Vocab-しずめる-Female.mp3]	In order to appease the god’s anger we need to offer a sacrifice.	<jp>神の怒りを鎮めるには、生贄を捧げる必要があります。</jp>	None	None	None	None	None	None
16	幸福	Happiness	Happiness,Luck	幸,福	With a little <kanji>luck</kanji> and <kanji>happiness</kanji> you can achieve <vocabulary>happiness</vocabulary>, though that goes without saying.	noun,な adjective	<reading><jp>こうふく</jp></reading>	こうふく	This is a jukugo word, which usually means on'yomi readings from the kanji. If you know the readings of your kanji you'll know how to read this as well.	[sound:Vocab-こうふく-Male.mp3]	[sound:Vocab-こうふく-Female.mp3]	I looked up some information about a religious group called Happy Science.	<jp>幸福の科学というしゅう教団体について調べてみました。</jp>	In order to bring happiness to Tofugu, Koichi tried to make all of his employees buy a happiness fugu charm for $10,000 each.	<jp>トーフグに幸福をもたらすために、コウイチはじゅう業員全員に幸福のフグのおまもりを一万ドルで買わせようとしました。</jp>	She was born under a lucky star and she has so much happiness in her life that she can’t help but cry every day.	<jp>彼女は幸運の星のもとに生まれたため、幸福すぎて毎日涙が止まらないんだよ。</jp>	None	None
55	重鎮	Leader,Authority	Heavy,Tranquilize	重,鎮	If you <kanji>tranquilize</kanji> yourself <kanji>heavy</kanji> enough you'll be just like all the other world <vocabulary>leader</vocabulary>s today. They're all pretty sedated. Tranquilize yourself too and you'll be just like them!	noun	<reading><jp>じゅうちん</jp></reading>	じゅうちん	This is a jukugo word that uses the on'yomi readings of the kanji. You should be able to read this on your own.	[sound:Vocab-じゅうちん-Male.mp3]	[sound:Vocab-じゅうちん-Female.mp3]	That company ushered in leaders of industry one after another to their staff.	<jp>彼の会社は、業界の重鎮達を次々と役員に迎え入れた。</jp>	None	None	None	None	None	None
16	入門	Admission,Entrance	Enter,Gates	入,門	If you are able to <kanji>enter</kanji> the <kanji>gate</kanji> then you have gained <vocabulary>admission</vocabulary> and <vocabulary>entrance</vocabulary> to the facility.	noun,する verb,の adjective	<reading><jp>にゅうもん</jp></reading>	にゅうもん	This is a jukugo word, which usually means on'yomi readings from the kanji. If you know the readings of your kanji you'll know how to read this as well.	[sound:Vocab-にゅうもん-Male.mp3]	[sound:Vocab-にゅうもん-Female.mp3]	I heard that Koichi is going to be a pupil of the famous kendo master.	<jp>コウイチは有名な剣道の先生のところに入門するそうですよ。</jp>	I haven't completed the admissions procedure yet.	<jp>入門手つづきをまだ終えていません。</jp>	Do you think that TextFugu is the best introduction to Japanese, even for someone like me who’s unfamiliar with it? Should I buy it?	<jp>日本語に馴染みのない私にとっても、テキストフグは絶好の入門書だと思う？買った方がいいかな？</jp>	None	None
60	思慕	Yearning,Deep Affection	Think,Yearn For	思,慕	If you can't stop <kanji>think</kanji>ing about how much you <kanji>yearn for</kanji> someone, that <vocabulary>yearning</vocabulary> can drive you crazy. Try to keep it in check, and enjoy how you can hold such <vocabulary>deep affection</vocabulary> for someone.	noun,する verb	<reading><jp>しぼ</jp></reading>	しぼ	This is a jukugo word that uses the on'yomi readings of the kanji. You should be able to read this on your own.	[sound:Vocab-しぼ-Male.mp3]	[sound:Vocab-しぼ-Female.mp3]	Being in a foreign country, I constantly yearn for my mother.	<jp>異国の地で、母への思慕を重ねています。</jp>	None	None	None	None	None	None
14	消化する	To Digest	Extinguish,Change	消,化	"You know how <jp>消化</jp> is ""digestion""? Well, The verb form of that is this word, which is <vocabulary>to digest</vocabulary>."	する verb	<reading><jp>しょうかする</jp></reading>	しょうかする	If you know <jp>消化</jp> you should be able to read this. Also, it uses the readings you learned with the kanji anyways, so no problemo there.	[sound:Vocab-しょうかする-Male.mp3]	[sound:Vocab-しょうかする-Female.mp3]	It looks like this cat couldn't digest the fish skin and threw it up.	<jp>このネコは、魚の皮をうまく消化できずにはいてしまったみたいです。</jp>	Tofugu recommends that all employees use all their paid days off.	<jp>トーフグは、全社員が有きゅう休かを完全消化することをすいしょうしています。</jp>	I just ate 100 pieces of fugu sashimi. It’s gonna take a while to digest. (Burp)	<jp>今、フグの刺し身を百切れ食べたよ。消化するのにちょっと時間がかかりそう。(ゲップ)</jp>	None	None
57	鼓動	Beat,Palpitate,Pulse,Throb	Drum,Move	鼓,動	The <kanji>beat</kanji> that <kanji>move</kanji>s inside your body is the <vocabulary>beat</vocabulary>ing of your heart. Put your hand up to your neck and you should be able to feel it <vocabulary>pulse</vocabulary>.	noun,する verb	<reading><jp>こどう</jp></reading>	こどう	This is a jukugo word that uses the on'yomi readings of the kanji. You should be able to read this on your own.	[sound:Vocab-こどう-Male.mp3]	[sound:Vocab-こどう-Female.mp3]	The young girl’s face turned red and her heart throbbed.	<jp>少女の顔が赤くなり、鼓動が高鳴りました。</jp>	None	None	None	None	None	None
14	流れる	To Stream,To Flow	Stream	流	This word consists of kanji with hiragana attached. Because the hiragana ends with an <jp>う</jp> sound, you know this word is a verb. The kanji itself means <kanji>stream</kanji>? It's <vocabulary>to stream</vocabulary> (though it's also <vocabulary>to flow</vocabulary>, a very similar word). You can differentiate this from <jp>流す</jp> because with <jp>流す</jp> you flush something down the toilet, which causes it to overflow so you <reading>sue</reading> (<jp>す</jp>) the toilet maker. With <jp>流れる</jp> you find a <reading>rare</reading> (<jp>れる</jp>) jewel trying to flow down the river. You grab it, and see it's a rare diamond!	intransitive verb,ichidan verb	<reading><jp>ながれる</jp></reading>	ながれる	The reading is the same as <jp>流す</jp>. So long as you know that you should be able to read this one as well!	[sound:Vocab-ながれる-Male.mp3]	[sound:Vocab-ながれる-Female.mp3]	After the bicycle race, sweat was streaming down Viet's face.	<jp>自転車のレースの後、ビエトの顔をあせがたきのように流れていました。</jp>	Which area does this river flow through?	<jp>この川は、どの地いきを流れているんですか？</jp>	I like the sound of flowing water, so just let your tears stream down your cheeks. See? It’s so beautiful.	<jp>流れる水の音が好きなので、涙が君の頬を流れるままにしておいてくれよ。ほら、とても美しいよ。</jp>	None	None
57	鼓膜	Eardrum	Drum,Membrane	鼓,膜	You can hear something <kanji>beat</kanji> because of a <kanji>membrane</kanji> in your ear called an <vocabulary>eardrum</vocabulary>. Make sure you don't stick your fingers too far in your ear or you could really hurt it. 	noun,の adjective	<reading><jp>こまく</jp></reading>	こまく	This is a jukugo word that uses the on'yomi readings of the kanji. You should be able to read this on your own.	[sound:Vocab-こまく-Male.mp3]	[sound:Vocab-こまく-Female.mp3]	If you play things that loudly you’ll tear your eardrums.	<jp>そんなに大声を出されたら鼓膜が破れるよ。</jp>	None	None	None	None	None	None
15	お願い	A Request,Request,Wish,Please	Request	願	The noun form of <kanji>request</kanji> (don't be tricked by the <jp>い</jp> on the end, it's not an adjective). So, request goes to <vocabulary>a request</vocabulary>.	noun,する verb	<reading><jp>おねがい</jp></reading>	おねがい	The reading is the same like <jp>お願いします</jp>. Hopefully you're able to read that by now so you're able to read this too.	[sound:Vocab-おねがい-Male.mp3]	[sound:Vocab-おねがい-Female.mp3]	Please! Help me!	<jp>お願い！手伝って！</jp>	"""Can you do me a favor...?"" ""Of course. Name it."""	<jp>「ちょっとお願いがあるんだけど……。」「もちろん。言ってみて。」</jp>	Smaller companies take on new challenges more rapidly, so they probably won't mind if we request a job like this.	<jp>中小企業は小回りが利くから、こういう仕事をお願いしても平気だろう。</jp>	None	None
14	自動	Automatic	Self,Move	自,動	Something that can <kanji>move</kanji> by its <kanji>self</kanji> is something that's <vocabulary>automatic</vocabulary>.	noun,の adjective	<reading><jp>じどう</jp></reading>	じどう	This is a jukugo word, which usually means on'yomi readings from the kanji. If you know the readings of your kanji you'll know how to read this as well.	[sound:Vocab-じどう-Male.mp3]	[sound:Vocab-じどう-Female.mp3]	I'm planning to buy a fully-automatic front loading washing machine with my bonus.	<jp>ボーナスで、全自動のフロントロードしきのせんたくきを買う予定です。</jp>	I set up my smartphone to automatically upload every single photo to the cloud.	<jp>スマホでとった写しんは、全て自動でクラウドにアップロードしてほぞんされるようにせっ定しています。</jp>	It’s Tofugu policy that workers caught eating Koichi’s bacon without permission are automatically fired.	<jp>Tofuguの方針で、許可無くコウイチのベーコンを食べた社員は、自動的に退職処分となる。</jp>	None	None
16	折り目	Fold,Crease	Fold,Eye	折,目	A <kanji>fold</kanji> you can see with your <kanji>eye</kanji> is a <vocabulary>fold</vocabulary> or <vocabulary>crease</vocabulary> in something.	noun	<reading><jp>おりめ</jp></reading>	おりめ	The readings are both kun'yomi vocab readings. You should have seen <jp>折る</jp> by now which should help you to read <jp>折り</jp>. Then there's <jp>目</jp>, which I'm guessing you won't have a problem with.	[sound:Vocab-おりめ-Male.mp3]	[sound:Vocab-おりめ-Female.mp3]	I hereby certify that these pants are without a single fold.	<jp>このズボンには、折り目がなかったということを、ここに証明いたします。</jp>	Please open the origami again after you fold it in half to add the crease.	<jp>折り紙を半分に折って、折り目をつけてからまた開いてください。</jp>	Could you put a crease in my trousers?	<jp>ズボンには折り目を付けてもらえますか？</jp>	None	None
16	自動的	Automatic	Self,Move,Target	自,動,的	"An <kanji>automatic</kanji><kanji>al</kanji> (<jp>自動</jp> + <jp>的</jp>) thing of course isn't ""automatical."" A better way to say it is to cut off the -al and call it <vocabulary>automatic</vocabulary>."	な adjective	<reading><jp>じどうてき</jp></reading>	じどうてき	This is a jukugo word, which usually means on'yomi readings from the kanji. If you know the readings of your kanji you'll know how to read this as well. It will help to know the reading of <jp>自動</jp> as well.	[sound:Vocab-じどうてき-Male.mp3]	[sound:Vocab-じどうてき-Female.mp3]	That's an automated tweet by a bot.	<jp>それは、ボットによる自動的なツイートですよ。</jp>	This train's doors don't open automatically.	<jp>この電車のドアは、自動的には開きません。</jp>	If someone breaks into your house this machine will automatically send a message to the security company.	<jp>もし誰かがあなたの家に侵入したら、この機械が自動的に警備会社に通報します。</jp>	None	None
14	卒業	Graduation	Graduate,Business	卒,業	The <kanji>business</kanji> of you <kanji>graduating</kanji> is your <vocabulary>graduation</vocabulary>. If you think about it, it's kind of a big business, getting you graduated from expensive schools. The graduation business focuses on graduations, and getting you there (hint: this business is a school, probably).	noun,する verb,の adjective	<reading><jp>そつぎょう</jp></reading>	そつぎょう	This is a jukugo word, which usually means on'yomi readings from the kanji. If you know the readings of your kanji you'll know how to read this as well.	[sound:Vocab-そつぎょう-Male.mp3]	[sound:Vocab-そつぎょう-Female.mp3]	In Japan, March is graduation season.	<jp>日本では三月が卒業のシーズンです。</jp>	Viet made an idol group called TFG48 and has been performing at its center for a long time, but it still doesn't look like he'll graduate. He is already 58 years old.	<jp>ビエトはTFG48というアイドルグループを作ってずっとセンターをつとめているが、いつまでたっても卒業する気配がない。もう58才なのに。</jp>	Teacher, do you think that being able to speak Japanese increases a graduate’s chances of finding a job?	<jp>先生は、日本語が話せると、卒業生の就職の可能性が高くなると思いますか？</jp>	None	None
