Level	Symbol	Meaning	Kanji Component Name	Kanji Component Symbol	Meaning Mnemonic	Word Type	Reading	Reading Whitelist	Reading Mnemonic	Reading Audio Male	Reading Audio Female	Context 1-EN	Context 1-JP	Context 2-EN	Context 2-JP	Context 3-EN	Context 3-JP	Context 4-EN	Context 4-JP
59	擬装	Disguise,Camouflage	擬,装	Imitate,Attire	Use <kanji>attire</kanji> that <kanji>imitate</kanji>s your surroundings to create a <vocabulary>disguise</vocabulary>. Or throw on some <vocabulary>camouflage</vocabulary> so that no one will be able to find you in Walmart.	noun,する verb,の adjective	<reading><jp>ぎそう</jp></reading>	ぎそう	This is a jukugo word that uses the on'yomi readings of the kanji. You should be able to read this on your own.	[sound:Vocab-ぎそう-Male.mp3]	[sound:Vocab-ぎそう-Female.mp3]	You must not excuse the food company’s disguise.	<jp>食品会社の擬装を許してはいけません。</jp>	None	None	None	None	None	None
16	門	Gate	門	Gates	The kanji and the word are exactly the same. That means they share meanings as well.	noun	<reading><jp>もん</jp></reading>	もん	This has the same reading as the kanji you learned, meaning you know the reading!	[sound:Vocab-もん-Male.mp3]	[sound:Vocab-もん-Female.mp3]	Our house is right next to the house with a brown gate.	<jp>私たちの家は、茶色い門のある家のすぐとなりです。</jp>	If you pass under the big gate, you will see the holy shrine.	<jp>あそこの大きい門をくぐると神でんが見えるよ。</jp>	The gate is locked.	<jp>門には鍵がかかっているんだ。</jp>	None	None
28	幼稚	Childish,Immature	幼,稚	Infancy,Immature	He who is both in his <kanji>infancy</kanji> and <kanji>immature</kanji> is probably <vocabulary>childish</vocabulary> and <vocabulary>immature</vocabulary>.	noun,な adjective,の adjective	<reading><jp>ようち</jp></reading>	ようち	This is a jukugo word, which usually means on'yomi readings from the kanji. If you know the readings of your kanji you'll know how to read this as well.	[sound:Vocab-ようち-Male.mp3]	[sound:Vocab-ようち-Female.mp3]	Why do so many Japanese girls speak like children?	<jp>どうして幼稚な喋り方をする日本人女性が多いのですか？</jp>	None	None	None	None	None	None
1	七	Seven	七	Seven	When a vocab is alone with no okurigana (that's hiragana attached to a kanji) it usually has the same meaning as the kanji too. That goes for this word as well. So, if you know the kanji's meaning (<kanji>seven</kanji>) you'll know the vocab's meaning (<vocabulary>seven</vocabulary>).	numeral	<reading><jp>なな</jp></reading>,<reading><jp>しち</jp></reading>	なな,しち	"Most single-kanji all-alone vocab words like this use the kun'yomi reading. Numbers are an exception to this rule. That being said, four and seven are exceptions to this exception to the rule (because the on'yomi readings sound too much like the word for ""death""). You should learn both readings for this word, though we're going to go with <jp>なな</jp> for the main one here. You can remember that because you had seven <reading>nana</reading>s after you."	[sound:Vocab-なな-Male.mp3],[sound:Vocab-しち-Male.mp3]	[sound:Vocab-なな-Female.mp3],[sound:Vocab-しち-Female.mp3]	Why don’t we meet at the station at seven tomorrow morning?	<jp>あしたのあさ、七じにえきであいませんか。</jp>	There are seven mandarin oranges.	<jp>みかんが七こあります。</jp>	I want to be friends with the seven dwarves.	<jp>七にんのこびととともだちになりたい。</jp>	None	None
60	慕う	To Adore,To Miss,To Yearn For	慕	Yearn For	This word consists of kanji with hiragana attached. Because the hiragana ends with an <jp>う</jp> sound, you know this word is a verb. The kanji itself means <kanji>yearn for</kanji>, so the verb version is <vocabulary>to yearn for</vocabulary>. But that sounds kinda old fashioned, so you can just use <vocabulary>to adore</vocabulary> too.	transitive verb,godan verb	<reading><jp>したう</jp></reading>	したう	"Since this word consists of a kanji with hiragana attached, you can bet that it will use the kun'yomi reading. You didn't learn that reading with this kanji, so here's a mnemonic to help you: 

You realize you're starting <vocabulary>to yearn for</vocabulary> someone way more than you used to. ""<reading>Sh*t</reading> (<jp>した</jp>)... "" you say to yourself. This wasn't supposed to happen. Anytime you start to adore someone like that you always know you're getting into a bunch of sh*t you don't want to deal with. Damn these emotions!"	[sound:Vocab-したう-Male.mp3]	[sound:Vocab-したう-Female.mp3]	I adored him like an older brother.	<jp>私は彼のことを兄のように慕っていました。</jp>	None	None	None	None	None	None
37	盛り上がる	To Swell,To Get Excited	盛,上	Pile,Above	"<jp>盛り上げる</jp> is ""to heap up"" - this has a similar idea, except now this is more like an excitement or swelling. As excitement heaps up in you, you are going <vocabulary>to get excited</vocabulary>. Note how <jp>上がる</jp> is in here. This means something is happening to you (or something else), but you're not doing the action. When you get all sorts of excitement building up in you, you aren't really doing it, it's just happening on its own in reaction to something else."	intransitive verb,godan verb	<reading><jp>もりあがる</jp></reading>	もりあがる	The reading comes from <jp>盛り</jp> and <jp>上がる</jp>. Let the excitement build as you realize you know the reading already.	[sound:Vocab-もりあがる-Male.mp3]	[sound:Vocab-もりあがる-Female.mp3]	Kids can take the most mundane, random things and get so excited.	<jp>子どもっていうのは、どんなささいなことでも手当たり次第に盛り上がることができるのよね。</jp>	None	None	None	None	None	None
16	笑顔	Smile,Smiling Face	笑,顔	Laugh,Face	A <kanji>laugh</kanji>ing <kanji>face</kanji> is a <vocabulary> smiling face</vocabulary> (or just a <vocabulary>smile</vocabulary>!). <jp>笑顔s</jp> all around!	noun,する verb	<reading><jp>えがお</jp></reading>	えがお	"The reading for this word won't make you <vocabulary>smile</vocabulary>, though. You were smiling, but then you heard about the reading of this kanji. It made you yell out ""<reading>EH</reading>??"" (<jp>え</jp>). Just watch out for the rendaku of <jp>かお</jp> to <jp>がお</jp>."	[sound:Vocab-えがお-Male.mp3]	[sound:Vocab-えがお-Female.mp3]	That smiling face proves Koichi's integrity, eh?	<jp>あの笑顔がコウイチのせい実さを証明しているよね。</jp>	The prince of this country is a very terrible man who kills his citizens with a smile.	<jp>この国の王子は笑顔で国民を殺すとてもひどい男です。</jp>	This smiling, lovely guy with me is Koichi.	<jp>この笑顔の素敵な男は俺の連れで、コウイチっていうの。</jp>	None	None
37	恥ずかしがる	To Be Shy,To Be Bashful	恥	Shame	"<jp>恥ずかしい</jp> is ""embarrassing."" This is the verb version. What happens when someone is embarrassed? They become shy and bashful. That's why this word is <vocabulary>to be shy</vocabulary> or <vocabulary>to be bashful</vocabulary>."	godan verb	<reading><jp>はずかしがる</jp></reading>	はずかしがる	The reading comes from <jp>恥ずかしい</jp>.	[sound:Vocab-はずかしがる-Male.mp3]	[sound:Vocab-はずかしがる-Female.mp3]	Although she was determined to become a stripper, she’s still shy about dancing naked in public.	<jp>ストリッパーになると自分で決断したにも関わらず、彼女はまだ人前で裸で踊ることを恥ずかしがっているんだよ。</jp>	None	None	None	None	None	None
38	内緒	Secret,Confidential	内,緒	Inside,Together	We're <kanji>inside</kanji> <kanji>together</kanji> on this information. Just you and me, inside our knowledge. It is <vocabulary>secret</vocabulary> and <vocabulary>confidential</vocabulary>.	noun,の adjective	<reading><jp>ないしょ</jp></reading>	ないしょ	This is a jukugo word that uses the on'yomi readings of the kanji. You should be able to read this on your own.	[sound:Vocab-ないしょ-Male.mp3]	[sound:Vocab-ないしょ-Female.mp3]	I secretly record conversations with my IC recorder.	<jp>私はICレコーダーで会話を内緒で録音します。</jp>	None	None	None	None	None	None
52	秩序	Order,Regularity,System,Method	秩,序	Order,Preface	The <kanji>preface</kanji> of <kanji>order</kanji> is still <vocabulary>order</vocabulary>. Because order is always prefaced by more order. Order keeps us all in check.	noun	<reading><jp>ちつじょ</jp></reading>	ちつじょ	This is a jukugo word that uses the on'yomi readings of the kanji. You should be able to read this on your own.	[sound:Vocab-ちつじょ-Male.mp3]	[sound:Vocab-ちつじょ-Female.mp3]	Please do not disturb order.	<jp>秩序を乱すようなことはしないでください。</jp>	None	None	None	None	None	None
60	弾劾	Impeachment,Accusation,Censure,Denunciation	弾,劾	Bullet,Censure	The final <kanji>bullet</kanji> of <kanji>censure</kanji> is <vocabulary>impeachment</vocabulary>. You've already been publicly humiliated and now you're being impeached because of it. Yikes.	noun,する verb	<reading><jp>だんがい</jp></reading>	だんがい	This is a jukugo word that uses the on'yomi readings of the kanji. You should be able to read this on your own.	[sound:Vocab-だんがい-Male.mp3]	[sound:Vocab-だんがい-Female.mp3]	A large-scale anti-government demonstration was held for the impeachment of the President.	<jp>大統領の弾劾を求める大規模な反政府デモが開かれました。</jp>	None	None	None	None	None	None
16	明治	Meiji Era,Meiji Emperor,Meiji	明,治	Bright,Cure	It’s the era of <kanji>Bright</kanji> <kanji>Rule</kanji>! If this doesn't make sense, don't worry about it. Focus more on the reading, which is <jp>めいじ</jp>. Sound familiar? This is the famous <vocabulary>Meiji Era</vocabulary> or <vocabulary>Meiji Emperor</vocabulary>. If you don't know about it consider reading up, it's interesting history!	noun	<reading><jp>めいじ</jp></reading>	めいじ	This is a jukugo word, which usually means on'yomi readings from the kanji. If you know the readings of your kanji you'll know how to read this as well.	[sound:Vocab-めいじ-Male.mp3]	[sound:Vocab-めいじ-Female.mp3]	My grandmother was born in the Meiji era, and she devotedly practiced the Buddhist teachings when she was alive.	<jp>明治生まれのそ母は、生前は仏教の教えをちゅう実に守っていました。</jp>	I'm writing a paper about the Meiji Restoration.	<jp>明治い新についてのろん文を書いています。</jp>	I was watching a drama series about life in the Meiji period and I was surprised that ten thousand yen was a large amount of money back then.	<jp>明治時代の生活を描いたドラマを見ているんですが、当時は一万円が大金だったということに驚きました。</jp>	None	None
51	苗	Seedling	苗	Seedling	The kanji and the word are exactly the same. That means they share meanings as well.	noun	<reading><jp>なえ</jp></reading>	なえ	"Since this word is made up of a single kanji, it probably uses the kun'yomi reading. You did not learn this reading, so here's a mnemonic to help you: 

The best time to plant <vocabulary>seedling</vocabulary>s is at <reading>nigh</reading>t (<jp>なえ</jp>). If you plant them at night they'll sleep through the whole transplanting process and they'll wake up happy and ready to grow."	[sound:Vocab-なえ-Male.mp3]	[sound:Vocab-なえ-Female.mp3]	I planted seedlings in April.	<jp>四月に苗を植えました。</jp>	None	None	None	None	None	None
43	潮	Tide,Current	潮	Tide	The kanji and the word are exactly the same. That means they share meanings as well.	noun	<reading><jp>しお</jp></reading>	しお	Since this word is made up of a single kanji, it probably uses the kun'yomi reading. You did not learn this reading, so here's a mnemonic to help you to remember: If you think of the tide, you think of the ocean. If you think of the ocean and what it's filled with (besides water) you think of <reading>salt</reading> (<jp>しお</jp>).	[sound:Vocab-しお-Male.mp3]	[sound:Vocab-しお-Female.mp3]	Can’t we find out when the tide rises by looking online?	<jp>インターネットで調べたら潮の満ち引きの時刻が分かるんじゃない？</jp>	None	None	None	None	None	None
38	遠慮	Restraint,Decline,Hesitation	遠,慮	Far,Consider	A <kanji>far</kanji> <kanji>consider</kanji> is when you let your considerations go far from you so you don't think about how angry you are about what's going on in front of you. It allows you to have some <vocabulary>restraint</vocabulary>, since your considerations are far from here. It also allows you to <vocabulary>decline</vocabulary> things, since you're not considering the other person's feelings.	noun,する verb,な adjective	<reading><jp>えんりょ</jp></reading>	えんりょ	This is a jukugo word that uses the on'yomi readings of the kanji. You've learned them both already, so you should be able to read this on your own.	[sound:Vocab-えんりょ-Male.mp3]	[sound:Vocab-えんりょ-Female.mp3]	Don’t hesitate to ask me any questions.	<jp>質問があればどんなものでも遠慮なくおっしゃって下さいね。</jp>	None	None	None	None	None	None
55	栓	Cork,Stopper,Plug	栓	Cork	The kanji and the word are exactly the same. That means they share meanings as well.	noun	<reading><jp>せん</jp></reading>	せん	This has the same reading as the kanji you learned, meaning you know the reading!	[sound:Vocab-せん-Male.mp3]	[sound:Vocab-せん-Female.mp3]	If you don’t have a bottle opener, I know a trick to open a beer bottle.	<jp>栓抜きが無くても瓶ビールの栓を抜く裏ワザを知っています。</jp>	None	None	None	None	None	None
60	吸い殻	Cigarette Butt,Tobacco Ashes	吸,殻	Suck,Husk	"This is a combination of the words <jp>吸う</jp> meaning ""to smoke"" and <jp>殻</jp> meaning ""shell"" or ""husk."" The husk left over after you're done smoking is the <vocabulary>cigarette butt</vocabulary>. Or <vocabulary>tobacco ashes</vocabulary> if you just have a pile of them."	noun	<reading><jp>すいがら</jp></reading>	すいがら	This is a combination of the words <jp>吸う</jp> and <jp>殻</jp>. Change the <jp>う</jp> to <jp>い</jp> and don't forget the rendaku, and you should be able to remember this reading too! 	[sound:Vocab-すいがら-Male.mp3]	[sound:Vocab-すいがら-Female.mp3]	If two cigarette butts pile up, please empty the ashtray immediately.	<jp>吸い殻が二本たまったら、すぐに灰皿を交換してください。</jp>	None	None	None	None	None	None
20	議論	Argument,Discussion,Controversy	議,論	Deliberation,Theory	"There is much <kanji>deliberation</kanji> and <kanji>theory</kanji> exchanging when you are trying to present an <vocabulary>argument</vocabulary>. Of course, it's a very nice one. Lots of thinking and stuff, you know? That's why there's deliberation and theories instead of just screaming. That kind of ""argument."""	noun,する verb	<reading><jp>ぎろん</jp></reading>	ぎろん	This is a jukugo word, which usually means on'yomi readings from the kanji. If you know the readings of your kanji you'll know how to read this as well.	[sound:Vocab-ぎろん-Male.mp3]	[sound:Vocab-ぎろん-Female.mp3]	Koichi and the others are discussing whether we should take a plane or a boat to Japan.	<jp>コウイチ達は、日本まで飛行機で行くか船で行くかで議論してるんだ。</jp>	The article that Michael wrote drew controversy.	<jp>マイケルが書いた記事は、大いに議論を呼んでいます。</jp>	Koichi and Viet argued on what to eat for dinner for hours without reaching a decision.	<jp>コウイチとビエトは、夕飯に何を食べるかについて数時間に渡って議論に議論を重ねたが、結論には至らなかった。</jp>	None	None
53	批准	Ratification,Ratify	批,准	Criticism,Semi	If there is only <kanji>semi</kanji> <kanji>criticism</kanji> on a law <vocabulary>ratification</vocabulary> is still possible. It's only if everyone criticizes it that it won't be ratified.	noun,する verb	<reading><jp>ひじゅん</jp></reading>	ひじゅん	This is a jukugo word that uses the on'yomi readings of the kanji. You should be able to read this on your own.	[sound:Vocab-ひじゅん-Male.mp3]	[sound:Vocab-ひじゅん-Female.mp3]	The ratification of New START is a maximum priority issue.	<jp>新戦略兵器削減条約の批准を最優先課題としています。</jp>	None	None	None	None	None	None
55	憂鬱	Depression,Melancholy,Dejection,Gloom	憂,鬱	Grief,Gloom	With lots of <kanji>grief</kanji> and <kanji>gloom</kanji> in your life you'll probably end up in a spiral of <vocabulary>depression</vocabulary>. Don't worry, you'll be okay. Things get better with time so don't give into the <vocabulary>gloom</vocabulary>.	noun,な adjective	<reading><jp>ゆううつ</jp></reading>	ゆううつ	This is a jukugo word that uses the on'yomi readings of the kanji. You should be able to read this on your own.	[sound:Vocab-ゆううつ-Male.mp3]	[sound:Vocab-ゆううつ-Female.mp3]	Working at a company is depressing.	<jp>会社へ出勤するのが憂鬱です。</jp>	None	None	None	None	None	None
38	欠伸	Yawn,Yawning	欠,伸	Lack,Stretch	When you <kanji>lack</kanji> <kanji>stretch</kanji>ing, your body has to get that energy out somehow, so you end up <vocabulary>yawning</vocabulary>.	noun	<reading><jp>あくび</jp></reading>	あくび	"The reading for this is an exception. Here's a mnemonic to help you:

You've never seen more <vocabulary>yawning</vocabulary> than when you performed <reading>acu</reading>puncture (<jp>あく</jp>) on a <reading>bee</reading> (<jp>び</jp>). It was so relaxed from being the one poked for once that it just couldn't stop yawning.
"	[sound:Vocab-あくび-Male.mp3]	[sound:Vocab-あくび-Female.mp3]	It was too boring and I yawned.	<jp>退屈すぎて欠伸が出てきた。</jp>	None	None	None	None	None	None
51	会釈	Nod,Greeting,Bow	会,釈	Meet,Explanation	Before you can give an <kanji>explanation</kanji> of who you are to someone you're about to <kanji>meet</kanji>, you have to <vocabulary>nod</vocabulary> or <vocabulary>bow</vocabulary> as a <vocabulary>greeting</vocabulary> first. It's rude to start explaining who you are before you greet them.	noun,する verb	<reading><jp>えしゃく</jp></reading>	えしゃく	"This is a jukugo word that uses the on'yomi readings of the kanji. You didn't learn this reading for <jp>会</jp> yet, so here's a mnemonic to help you:

When someone <vocabulary>bow</vocabulary>s to you, you always feel a little uncomfortable, so you say, ""<reading>Eh</reading>"" (<jp>え</jp>) and try to get them to stop. You're so uncomfortable that you can't think of words and ""eh"" is all you can manage to get out."	[sound:Vocab-えしゃく-Male.mp3]	[sound:Vocab-えしゃく-Female.mp3]	You might have the decency to return my nod with a nod.	<jp>会釈をしたら会釈を返すのが礼儀でしょう。</jp>	None	None	None	None	None	None
11	最初	The First,First,Beginning,Outset	最,初	Most,First	The <kanji>most</kanji> <kanji>first</kanji> thing is <vocabulary>the first</vocabulary> thing.	noun,の adjective	<reading><jp>さいしょ</jp></reading>	さいしょ	This is a jukugo word, which usually means on'yomi readings from the kanji. If you know the readings of your kanji you'll know how to read this as well.	[sound:Vocab-さいしょ-Male.mp3]	[sound:Vocab-さいしょ-Female.mp3]	I'm gonna start with a draft beer!	<jp>最初はとりあえず生で！</jp>	Koichi's first girlfriend's name was Koichiko.	<jp>コウイチの最初のかの女の名前はコウイチ子でした。</jp>	You’re awful at this! Even a newbie couldn’t be that bad! When I played this game for the first time I was way better than you.	<jp>お前本当に下手くそだな！初心者でもこんなに下手くそじゃねぇだろ。俺が最初にこのゲームをプレイした時は、お前よりずっと上手かったわ。</jp>	None	None
38	暖房	Heating,Heat	暖,房	Warm,Cluster	"A <kanji>warm</kanji> <kanji>cluster</kanji> is when you get a bunch of warmth together, and then use it to warm your home. This is indoor <vocabulary>heating</vocabulary>, kind of like the same way how an air conditioner is a ""cool cluster."""	noun,する verb	<reading><jp>だんぼう</jp></reading>	だんぼう	This is a jukugo word that uses the on'yomi readings of the kanji. You should be able to read this on your own.	[sound:Vocab-だんぼう-Male.mp3]	[sound:Vocab-だんぼう-Female.mp3]	Why did you turn off the heat? All the pipes are completely frozen!	<jp>何で暖房消したの？パイプが全部凍っちゃったじゃない。</jp>	None	None	None	None	None	None
28	〜券	Ticket	券	Ticket	The kanji and the word are exactly the same. That means they share meanings as well.	noun,suffix	<reading><jp>けん</jp></reading>	けん	The reading is the same as what you learned with the kanji. Usually it's attached to things, because it tells you what kind of ticket something is.	[sound:Vocab-けん-Male.mp3]	[sound:Vocab-けん-Female.mp3]	Can I get a commuter pass for three consecutive months?	<jp>三ヶ月の定期券をもらえますか？</jp>	None	None	None	None	None	None
38	併合	Merger	併,合	Join,Suit	<kanji>Join</kanji> and <kanji>join</kanji> with each other. This is a <vocabulary>merger</vocabulary>.	noun,する verb	<reading><jp>へいごう</jp></reading>	へいごう	This is a jukugo word that uses the on'yomi readings of the kanji. You should be able to read this on your own. Just remember that <jp>合</jp> is read as <jp>ごう</jp> here. Who orchestrated this merger? Good ol' grandpa <jp>ごういち</jp>.	[sound:Vocab-へいごう-Male.mp3]	[sound:Vocab-へいごう-Female.mp3]	The United States of America annexed Texas the year I was born.	<jp>アメリカ合衆国は、私が生まれた年にテキサスを併合しました。</jp>	None	None	None	None	None	None
53	緯度	Latitude	緯,度	Latitude,Degrees	<kanji>Degrees</kanji> of <kanji>latitude</kanji> are still called <vocabulary>latitude</vocabulary>.	noun,の adjective	<reading><jp>いど</jp></reading>	いど	This is a jukugo word that uses the on'yomi readings of the kanji. You should be able to read this on your own.	[sound:Vocab-いど-Male.mp3]	[sound:Vocab-いど-Female.mp3]	I can look up the latitude and longitude on my GPS.	<jp>GPSで経度や緯度が検索できます。</jp>	None	None	None	None	None	None
21	得体	Character,Nature	得,体	Acquire,Body	"With time your <kanji>body</kanji> will <kanji>acquire</kanji> a certain type of <vocabulary>character</vocabulary>. It shows your true <vocabulary>nature</vocabulary> as a person.

Note: We almost always use this word in the phrases <jp>得体が知れない</jp>/<jp>得体の知れない</jp>, so check out the context sentences to see what kind of ""character"" we're talking about."	noun	<reading><jp>えたい</jp></reading>	えたい	The reading is a combination of kun'yomi and on'yomi readings. That being said, both readings for both kanji are the readings you learned already, so you should be able to read this.	[sound:Vocab-えたい-Male.mp3]	[sound:Vocab-えたい-Female.mp3]	I can’t eat something so strange.	<jp>こんな得体の知れないもの、食べられないよ。</jp>	I thought a mysterious man was looking at me, but it turned out to be Koichi from Tofugu.	<jp>得体の知れない男がさっきからこっちを見ていると思ったら、トーフグのコウイチだった。</jp>	I suddenly felt as if something unidentifiable was coming towards me at furious speeds and I started sweating with fear.	<jp>得体の知れない何かが、猛スピードで迫ってくるような感覚に襲われ、冷や汗が止まらなくなりました。</jp>	None	None
28	精度	Precision,Accuracy	精,度	Spirit,Degrees	The <kanji>degree</kanji> of your <kanji>spirit</kanji> is what helps you to hone your <vocabulary>precision</vocabulary> and <vocabulary>accuracy</vocabulary>, for some reason. Just imagine yourself throwing a ball. You miss the target. Hmm, okay... time to power up like on Dragonball. Up that spirit energy. Turn the degrees up on it. Boom. Awesome. Now throw again. Hit! You hit it! What great <vocabulary>precision</vocabulary> you have gained by honing your spirit!	noun	<reading><jp>せいど</jp></reading>	せいど	This is a jukugo word, which usually means on'yomi readings from the kanji. If you know the readings of your kanji you'll know how to read this as well.	[sound:Vocab-せいど-Male.mp3]	[sound:Vocab-せいど-Female.mp3]	Even though the 3D printer was invented, it would take a while for its technology to catch up with our high precision grinding machines.	<jp>3Dプリンタは発明されたものの、我々の高精度の研削盤に技術が追いつくにはまだ時間がかかるだろう。</jp>	None	None	None	None	None	None
